Attraction,City
Beach Day In Falassarna From Chania,"Crete, Greece"
"Hiking Samaria, from Heraklion","Crete, Greece"
Private Exclusive Manousakis Winery and Vineyard Tour in Chania,"Crete, Greece"
Between the Myths & Locals: Zeus Cave & Lassithi Plateau Villages,"Crete, Greece"
"Hire Photographer, Professional Photo Shoot - Crete","Crete, Greece"
Family Excursion: From Sea Wonders to Mythical Realms Adventure,"Crete, Greece"
Cretan Olive Oil Tasting and Cretan Cuisine in Agia Varvara,"Crete, Greece"
Ecobike All inclusive - 2 Day tour - discover the real Crete,"Crete, Greece"
From Rethymno Visit of Knossos & Winery with tastings & Lunch,"Crete, Greece"
Half-Day Private Tour in Two Wineries and Archanes from Heraklion,"Crete, Greece"
Private Airport Transfers from Chania Airport to Chania town,"Crete, Greece"
Half day Snorkelling course - no previous experience needed!,"Crete, Greece"
Heraklion Vibes - Night Walking - Private Tour,"Crete, Greece"
Luxury Tour from Elounda: Knossos Palace & Museum with Wineries,"Crete, Greece"
Balos,"Crete, Greece"
Creta Private Transfer from Heraklion (HER) Airport to Gouves,"Crete, Greece"
Explore on Foot the Historical City of Heraklion (Small-Group),"Crete, Greece"
Romantic Luxury Sunset sails & Heraklion city free time,"Crete, Greece"
ARADENA GORGE hike adventure,"Crete, Greece"
Apicorno Trails Chania Bike Tour,"Crete, Greece"
Historical interactive tour in Heraklion - the siege and the fall of the city,"Crete, Greece"
Crete Private Taxi and Transfer from Chania to Georgioupoli,"Crete, Greece"
Bali Private Instaggram Tour paradise gate,"Crete, Greece"
5-Hour Shared River Trekking in Kourtaliotiko Gorge,"Crete, Greece"
V.I.P. Safari Krousonas Psiloritis,"Crete, Greece"
Knossos Museum and Heraklion tour from Rethymno,"Crete, Greece"
Greece See and Do Classic Route in 11 Days: 1st Class Custom Tour,"Crete, Greece"
"Food Odyssey, A Historical Culinary Tour of Chania","Crete, Greece"
All inclusive Private tour: Sunset at Falasarna Beach from Chania,"Crete, Greece"
Rethymnon Sunset Safari Tour,"Crete, Greece"
Percy Jackson Inspired Youth & Family Private Experience,"Crete, Greece"
Culinary Journey to Lassithi Plateau. Land of Gods & Food Artistry from Elounda,"Crete, Greece"
Try Snorkeling in the Sea with the Blue Dolphin Team,"Crete, Greece"
Crete Mainland 4x4 Self-Drive Safari with Lunch in Kastelli,"Crete, Greece"
Escape to South Rethymno. Hike and swim away from the crowds,"Crete, Greece"
"Minoan Path: Knossos Palace, Winery Visit, Lunch at Archanes","Crete, Greece"
Knossos Palace guided tour - Heraklion City tour + market,"Crete, Greece"
Private Cretan Gastronomic experience Winery visit with Tastings & Cooking Class,"Crete, Greece"
"Full-Day Tour to Vai Palm Beach, Toplou Monastery, and Sitia Town","Crete, Greece"
Travel Crete (Full day Private tours),"Crete, Greece"
Knossos Palace: Self-Guided Audio Tour on your Phone (without ticket),"Crete, Greece"
Gramvousa Island and Balos Bay Full-Day Tour from Chania,"Crete, Greece"
Countryside Private Tour,"Crete, Greece"
Knossos from Chania,"Crete, Greece"
Gramvousa Island & Balos Bay Full-Day Tour from Rethymno English & German guide,"Crete, Greece"
Elafonissi Beach From Rethimno,"Crete, Greece"
Cretan Night with Dinner & Live Show,"Crete, Greece"
"Tour in Crete, Rethymno, Arkadi Monastery, Margarites Pottery","Crete, Greece"
Quest of True Love Outdoor Escape Game in Chania,"Crete, Greece"
"Explore Chania Town, Venetian Harbor, and Ancient Aptera.","Crete, Greece"
Elounda: Spinalonga Prof. Guided Boat Tour w/ BBQ + Swimming,"Crete, Greece"
Chania city 5 hours free time from Rethymno,"Crete, Greece"
Elafonissi From Chania Private Tour,"Crete, Greece"
Imbros Gorge from Rethymno,"Crete, Greece"
Cruise to Santorini Island from Heraklion,"Crete, Greece"
Knossos palace (Last minute booking - Skip The Line Ticket),"Crete, Greece"
Hike Agia Irini Gorge Private Tour (price per group of 6),"Crete, Greece"
Crete Private Transfer from Agios Nikolaos city to Chania (CHQ) Airport,"Crete, Greece"
Elafonisi Day Tour from Rethymno,"Crete, Greece"
Elafonissi Beach Tour From Chania,"Crete, Greece"
Heraklion Airport (HER) to Heraklion - Arrival Private Transfer,"Crete, Greece"
Gramvoussa - Balos,"Crete, Greece"
Chania old town - Lake Kournas - Rethymno,"Crete, Greece"
"Cretan Folklore Night with Live Music, Dance, and Greek Dinner","Crete, Greece"
Rethymno Barbarossa Pirate Ship Cruise,"Crete, Greece"
"Samaria the Lazy Way, from Chania","Crete, Greece"
Elafonissi Beach Crete Day Trip,"Crete, Greece"
Preveli Beach and Rethymno Old Town Tour,"Crete, Greece"
Full-Day Knossos And Heraklion Tour From Chania,"Crete, Greece"
Heraklion Hop-On Hop-Off Bus Tour,"Crete, Greece"
Half Day Semi-Private Wine Tour of 2 wineries with wine Tastings,"Crete, Greece"
Private Full Day Tour To Balos Lagoon and Falasarna,"Crete, Greece"
Private Transfer from Sitia (JSH) Airport to Fodele,"Crete, Greece"
Private Transfer from Sitia (JSH) Airport to Ferma,"Crete, Greece"
Private Transfer from Maleme to Sitia (JSH) Airport,"Crete, Greece"
Full-Day Tour To Preveli Palm Beach from Heraklion,"Crete, Greece"
Private Wine Tour and Tastings at Dafnes Valley (Lunch Included),"Crete, Greece"
PRIVATE Jeep Safari 4x4 Area Heraklion with Lunch,"Crete, Greece"
Agia Triada Monastery-Stavros beach-Venizelos Graves - Half Day Private Tour,"Crete, Greece"
Private Helicopter Transfer from Heraklion to Athens,"Crete, Greece"
Samaria Gorge - VIP Private Tour,"Crete, Greece"
Private Transfer from Atsipopoulo to Sitia (JSH) Airport,"Crete, Greece"
Transfer Heraklion Airport or Port to Ammoudara Agios Nikolaos up to 4 customers,"Crete, Greece"
Private Transfer from Heraklion city to Heraklion Cruise Port,"Crete, Greece"
Private Transfer from Platanias to Sitia (JSH) Airport,"Crete, Greece"
Private Transfer from Sitia (JSH) Airport to Zakros,"Crete, Greece"
Creta Private Transfer from Chania (CHQ) Airport to Sissi,"Crete, Greece"
Transfer from Chania airport to Elafonisi up to 3 or vise versa,"Crete, Greece"
Transfer Heraklion Airport to AMMOUDARA HERAKLION area up to 7,"Crete, Greece"
Private Transfer from Eloúnda to Sitia (JSH) Airport,"Crete, Greece"
Explore Rethymno History with Arts and Crafts Private Tour,"Crete, Greece"
"Wheelchair Accessible Tour to Rethymno, Kournas and Georgioupoli","Crete, Greece"
Crete Private Transfer from Gerani city to Heraklion (HER) Airport,"Crete, Greece"
Cruise to Gramvousa Peninsula and Balos Lagoon fom Heraklion,"Crete, Greece"
Cretans Real Life,"Crete, Greece"
Private 8-Days hiking in Southwest Crete from Heraklion,"Crete, Greece"
Transfer from Chania airport to Georgioupolis up to 3,"Crete, Greece"
"ONE WAY: Santorini Thira Airport (JTR) to OIA, Greece","Crete, Greece"
Tsoutsouras Canyon Canyoning -Crete,"Crete, Greece"
Transfer Heraklion Airport to AGIA GALINI area up to 7 customers,"Crete, Greece"
Snorkelling and Freediving experience,"Crete, Greece"
Private Tour to Chania-Agia Triada monastery-Venizelos Graves,"Crete, Greece"
Your personal Photographer in Chania,"Crete, Greece"
Creta Private Transfer from Heraklion (HER) Airport to Koutsounari,"Crete, Greece"
Best of East Crete (2-Days private tour),"Crete, Greece"
Private Powerboat Tour to Balos Lagoon and Gramvousa Island,"Crete, Greece"
Cretan Cooking Class at Archanes Village with transfer & Lunch,"Crete, Greece"
Chania Morning Catamaran Cruise with Snorkeling and Lunch,"Crete, Greece"
Private Full Day Tour from Heraklion in Crete,"Crete, Greece"
Hiking adventure in the Polyrrinia & Sirikari Gorge. Private tour,"Crete, Greece"
Private transfer from Agios Nikolaos to Heraklion airport,"Crete, Greece"
Creta Private Transfer from Heraklion (HER) Airport to Makrigialos,"Crete, Greece"
Hike Imbros Gorge and Beach Private Tour (price per group of 6),"Crete, Greece"
VIP HERAKLION CITY TOUR up to 4 customers,"Crete, Greece"
"Rethymno City, Chania City, Kournas Lake Tour from Heraklion","Crete, Greece"
Transfer Heraklion Airport to LIGARIA area up to 7 customers,"Crete, Greece"
Full-Day Private Tour in Matala Crete,"Crete, Greece"
Private tour to Elafonissi Beach from Rethymno,"Crete, Greece"
Crete Private Transfer from Malia city to Heraklion (HER) Airport,"Crete, Greece"
Full-Day Private Guided Tour to East Coast of Crete from Chania,"Crete, Greece"
Full-Day Guided Boat Tour with Lunch in Island Spinalonga,"Crete, Greece"
Private Photo Session with a Local Photographer in Heraklion,"Crete, Greece"
"Cretan Odyssey Peaks, Valleys, and Cultural Revelations Await You","Crete, Greece"
Private Transfer from Sitia (JSH) Airport to Sfakia,"Crete, Greece"
Creta Private Transfer from Heraklion (HER) Airport to Milatos,"Crete, Greece"
Crete Private Transfer from Gouves city to Heraklion (HER) Airport,"Crete, Greece"
Crete Private Taxi and Transfer from Chania to Bali,"Crete, Greece"
Plakias: A Wine Cruise to South Crete,"Crete, Greece"
Creta Private Transfer from Chania (CHQ) Airport to Milatos,"Crete, Greece"
Private Transfer from Sitia (JSH) Airport to Palekastro,"Crete, Greece"
Private Tour in Imbros Gorge & Frangokastello Beach,"Crete, Greece"
Private Transfer from Panormos to Sitia (JSH) Airport,"Crete, Greece"
Powerboat Tour Theodorou Island Half Day Morning or Sunset,"Crete, Greece"
"Full Day Tour: Richtis Waterfall, Mochlos & Voulisma Beach Escape","Crete, Greece"
Private Tour to Knossos Palace and Lassithi Plateau from Elounda,"Crete, Greece"
Lady of the Angels Monastery and Thousand Flowers Falasarna Beach,"Crete, Greece"
3 Hour Manousakis Winery Taste with Shuttle Service,"Crete, Greece"
Half-day Private Island Road Tour in North Milos,"Crete, Greece"
Full-Day Guided Tour to Preveli Tropical Beach and Palm Forest,"Crete, Greece"
Photo Safari Tour in South Crete,"Crete, Greece"
Private Tour: Exploring Rethymnon and Villages,"Crete, Greece"
Romantic Walking Tour of Heraklion,"Crete, Greece"
Cretan Family Dinner overlooking Crete,"Crete, Greece"
Chania Airport (CHQ) to/from Central Chania up to 15 prs,"Crete, Greece"
Knossos and Authentic Crete Private Tour with Local Experiences,"Crete, Greece"
"Jeep Safari True Crete Melidoni Cave, Secrets of Honey, Olive Oil","Crete, Greece"
Heraklion Wine Roads,"Crete, Greece"
Chania Boat Rental with or without Skipper,"Crete, Greece"
East Crete Tour 4 to 15 customers,"Crete, Greece"
"Full Day Lake Kournas, Chania City and Souda Bay Tour","Crete, Greece"
Crete Private Transfer from Heraklion city to Chania (CHQ) Airport,"Crete, Greece"
Crete Private Transfer from Analipsis city to Heraklion (HER) Airport,"Crete, Greece"
Olive Oil & Wine Now & Then Luxury Private Experience,"Crete, Greece"
Private Transfer from Sitia (JSH) Airport to Agios Nikolaos,"Crete, Greece"
Exploring Heraklion and its Villages,"Crete, Greece"
Motoryacht Fun Day - VIP Private Excursion - Explore & Swim & Food,"Crete, Greece"
Day Trip to Santorini from Crete with Private Tour & Transfers,"Crete, Greece"
Creta Private Transfer from Chania (CHQ) Airport to Sitia,"Crete, Greece"
"Private Hands on Cooking Class with Aggeliki, transfer Included","Crete, Greece"
VIP Private Transfer: Heraklion - Rethymno Hotels & Villas,"Crete, Greece"
Custom Jeep Tours A Consummately Curated Odyssey from Rethymno,"Crete, Greece"
Private Helicopter Transfer from Chania to Athens,"Crete, Greece"
Crete Private Taxi and Transfer from Kalyves to Heraklion Airport,"Crete, Greece"
Private Wine Tour from Chania,"Crete, Greece"
Crete Private Taxi and Transfer from Chania to Adelianos Kampos,"Crete, Greece"
Chania Airport (CHQ) to/from Chania suburbs- ZONE 3 -up to 15 prs,"Crete, Greece"
Private Transfer from Koutsouras to Sitia (JSH) Airport,"Crete, Greece"
Private Transfer from Sitia (JSH) Airport to Kalyves,"Crete, Greece"
Cretan Wine Tour and Tasting with a Local Expert,"Crete, Greece"
Crete Private Taxi and Transfer from Gerani to Heraklion Airport,"Crete, Greece"
Chania Airport (CHQ) to/from Chania suburbs- ZONE 2 -up to 15 prs,"Crete, Greece"
Rethymno Town and St. Irini Monastery Private Tour from Chania,"Crete, Greece"
The best of Elounda walking tour,"Crete, Greece"
Private Transfer from Sitia (JSH) Airport to Skaleta,"Crete, Greece"
Gramvousa and Balos Lagoon Tour from Heraklion With Food Option,"Crete, Greece"
Private Transfer from Sitia (JSH) Airport to Plakias,"Crete, Greece"
Rent a rib boat (per hour),"Crete, Greece"
Shared Buggy Safari in Crete with a Guide,"Crete, Greece"
Powerboat Tour to Balos Lagoon and Gramvousa Island Half Day,"Crete, Greece"
Crete Private Transfer from Milatos city to Heraklion (HER) Airport,"Crete, Greece"
Full-Day Private Tour to South Coast of Crete from Chania,"Crete, Greece"
Heraklion & Knossos Museum Tour up to 4 Customers,"Crete, Greece"
Elafonissi Beach and Chania City Tour From Rethymno,"Crete, Greece"
El Greco Tour with pickup from Heraklion,"Crete, Greece"
Full Day Private Shore Tour in Heraklion from Heraklion Port,"Crete, Greece"
Spinalonga and Agios Nikolaos - VIP Private Tour,"Crete, Greece"
Private Transfer from Pachia Ammos to Sitia (JSH) Airport,"Crete, Greece"
Private Transfer from Sitia (JSH) Airport to Georgioupoli,"Crete, Greece"
Wine and Olive Trails of Crete,"Crete, Greece"
Agios Nikolaos-Spinalonga-Elounda Tour TR,"Crete, Greece"
Shared Guided Tour of Heraklion Archaeological Museum,"Crete, Greece"
4 Hour Herb Cooking Class in Heraklion,"Crete, Greece"
Private Guided Tour to Hydra The Lordly Island of Senses,"Crete, Greece"
Private Transfer from Fodele to Sitia (JSH) Airport,"Crete, Greece"
Private Transfer from Heraklion to Sitia (JSH) Airport,"Crete, Greece"
Private Transfer from Xirokampos to Sitia (JSH) Airport,"Crete, Greece"
Private Transfer from Kasteli Kissamos to Sitia (JSH) Airport,"Crete, Greece"
All Inclusive Private Tour: West Chania Discovery with lunch,"Crete, Greece"
Private Transfer from Kato Zakros to Sitia (JSH) Airport,"Crete, Greece"
Half Day Cretan Cooking and Dinner in a Hidden Stone Cottage,"Crete, Greece"
Transfer Heraklio Airport to ANALIPSI area up to 7 customers,"Crete, Greece"
Private Premium Day Sailing Catamaran Cruise in Rethymno,"Crete, Greece"
Private professional Vacation photoshoot in Chania,"Crete, Greece"
Full Day Knossos Palace Zeus Cave Lassithi Plateau from Elounda,"Crete, Greece"
Creta Private Transfer from Chania (CHQ) Airport to Makrigialos,"Crete, Greece"
Private Transfer from Chania Souda Cruise Port to Chania hotels,"Crete, Greece"
Chania Old Town Half Day Walking Tour,"Crete, Greece"
"Shore Explore Chania: City Charm, Beach Bliss & Sacred Sites","Crete, Greece"
Best of West Crete (2-Days private tour),"Crete, Greece"
Private Transfer from Heraklion Cruise Port to Chania city hotels,"Crete, Greece"
Sunset Private Tour in Falassarna,"Crete, Greece"
Wine Tasting Experience @ Lyrarakis Winery (Transfer Included),"Crete, Greece"
Private Wine Tour Olive Oil Tasting and Pottery from Heraklion,"Crete, Greece"
Private Transfer from Adele to Sitia (JSH) Airport,"Crete, Greece"
Crete Private Transfer from Kokkini Hani city to Heraklion (HER) Airport,"Crete, Greece"
Private Transfer from Ferma to Sitia (JSH) Airport,"Crete, Greece"
Archaeological Museum and Κnossos Palace Guided Tour Half Day,"Crete, Greece"
Cooking Classes in Crete. Cook Like a Cretan,"Crete, Greece"
Private Transfer from Sitia (JSH) Airport to Adele,"Crete, Greece"
Creta Private Transfer from Chania (CHQ) Airport to Gouves,"Crete, Greece"
Transfer Heraklion Airport to AGIA PELAGIA area up to 7 customers,"Crete, Greece"
Morning Private Tour from Chania to secret destinations &Akrotiri via Macherida,"Crete, Greece"
Private Transfer from Chania city Hotels to Heraklion Cruise Port,"Crete, Greece"
Private Luxury Tour in East Crete,"Crete, Greece"
"Minoan Tour in Ancient Palaces, Messara Wine Routes & Matala","Crete, Greece"
Private Tour to Arkadi Monastery and Rethymno from Heraklion,"Crete, Greece"
Full Day Preveli Palm Beach & Rethymno City Tour From Heraklion,"Crete, Greece"
Snorkeling Boat Trip with Motor Yacht,"Crete, Greece"
Buggy Safari Tours Heraklion Crete,"Crete, Greece"
Full Day Guided Tour in Faistos - Ag. Galini - Matala - Spili,"Crete, Greece"
Cretan Villages with Patsos Gorge Tour,"Crete, Greece"
Small Group Tour to Archaeological Sites of Gortyna and Phaistos,"Crete, Greece"
Κnossos Palace Guided Half Day Tour,"Crete, Greece"
Minoan Day Experience,"Crete, Greece"
Full Day Spinalonga Elouda Agios Nikolaos Olive factory Tour,"Crete, Greece"
Full day Spinalonga Ag Nikolaos Kritsa Olive Tour from Heraklion,"Crete, Greece"
Private Transfer from Sitia (JSH) Airport to Gerani,"Crete, Greece"
Full-Day Tour Knossos and Heraklion From Chania,"Crete, Greece"
"Hike in Rethymno: Maroulas... Unkown but fabulous path, for real explorers","Crete, Greece"
Chania Old Town private walking tour,"Crete, Greece"
Photographic Tour in Abandoned Chania & Cretan Beer by the Sea,"Crete, Greece"
Private sunset trip from Chania,"Crete, Greece"
Creta Private Transfer from Chania (CHQ) Airport to Agia Fotia,"Crete, Greece"
Full Day Ecobike - Discover old Villages & food Tasting,"Crete, Greece"
Crete Private Transfer from Milatos city to Chania (CHQ) Airport,"Crete, Greece"
Crete Private Transfer from Koutsounari city to Heraklion (HER) Airport,"Crete, Greece"
"Plakias, Spili and Kotsifou Canyon Jeep Safari 4x4","Crete, Greece"
Private Transfer from Sitia (JSH) Airport to Maleme,"Crete, Greece"
Cafe Marina - Wine Tasting on a Boat,"Crete, Greece"
Half-Day Canyoning Experience in Tsoutsouros from Iraklio,"Crete, Greece"
Private Transfer from Plaka to Sitia (JSH) Airport,"Crete, Greece"
Crete Private Taxi and Transfer from Chania to Panormo,"Crete, Greece"
Transfer Heraklion Airport to KOUTOULOUFARI area up to 7,"Crete, Greece"
Private Transfer from Sitia City to Sitia (JSH) Airport,"Crete, Greece"
Private One-way Airport Transfer (Chania Airport To/From Chania),"Crete, Greece"
Chania Pink Beaches Private Tour: Elafonisi & Falassarna,"Crete, Greece"
Private Helicopter Transfer from Chania to Santorini,"Crete, Greece"
Private Professional Vacation Photoshoot in Heraklion,"Crete, Greece"
Crete Private Transfer from Georgioupoli city to Heraklion (HER) Airport,"Crete, Greece"
Creta Private Transfer from Chania (CHQ) Airport to Anissaras,"Crete, Greece"
Private Transfer from Sitia (JSH) Airport to Chania Airport,"Crete, Greece"
Private Interactive Cooking Class with Aggeliki,"Crete, Greece"
Matala Hippie Beach,"Crete, Greece"
Private Transfer from Sitia (JSH) Airport to Chania,"Crete, Greece"
Private Van Tour from Chania to Monasteries,"Crete, Greece"
Creta Private Transfer from Heraklion (HER) Airport to Eloúnda,"Crete, Greece"
Imbros Gorge Adventure Day Trip from Chania,"Crete, Greece"
Full-Day Private Culinary Oil and Wine Tasting Tour in Crete,"Crete, Greece"
Full Day Visit with family the Highland Pastures of Psiloritis,"Crete, Greece"
Cretan Cooking Classes in a magic garden,"Crete, Greece"
Full-Day Samaria Gorge Private Hiking Tour,"Crete, Greece"
Heraklion Airport to South Rethymno or Reverse Trip up 8 Pax,"Crete, Greece"
Rethymno Food and Wine Lovers Private Tour with Tastings,"Crete, Greece"
Private Transfer from Sitia (JSH) Airport to Missiria,"Crete, Greece"
Tango Lessons in Apocoronas Area,"Crete, Greece"
Crete Private Transfer from Kokkini Hani city to Chania (CHQ) Airport,"Crete, Greece"
4 hrs Private Boat Trip - Mirabello Gulf and Spinalonga Peninsula,"Crete, Greece"
Coastal Odyssey: A Private Full-Day Tour from Chania,"Crete, Greece"
Sailing in South Crete with Transfer from Rethymnon,"Crete, Greece"
Private Transfer from Ierapetra to Sitia (JSH) Airport,"Crete, Greece"
Uncharted East Crete & Local Secrets Private Tour from Elounda,"Crete, Greece"
Crete's Hidden Wonders: Private Tour to Zeus Cave & Lasithi,"Crete, Greece"
Private Transfer from Platanes to Sitia (JSH) Airport,"Crete, Greece"
Private Transfer from Lygaria to Sitia (JSH) Airport,"Crete, Greece"
Custom Jeep Tours: A Consummately Curated Odyssey from Chania,"Crete, Greece"
"""Full-Day Private Tour to Poros Island from Athens""","Crete, Greece"
Private Transfer from Sitia (JSH) Airport to Pachia Ammos,"Crete, Greece"
Private Transfer from Chania Airport to Sitia (JSH) Airport,"Crete, Greece"
Creta Private Transfer from Chania (CHQ) Airport to Analipsis,"Crete, Greece"
The Minoan Settlement of Karfi: Hiking on the Lasithi Plateau,"Crete, Greece"
Private transfer from Heraklion airport to Rethymno,"Crete, Greece"
One-Way Shared Transfer From/To Chania Airport To Plakias,"Crete, Greece"
Crete Private Transfer from Agios Nikolaos city to Heraklion (HER) Airport,"Crete, Greece"
Full Private Cruise to Thodorou with the Rovinsonas boat via Balos and Gamvousa,"Crete, Greece"
Skip the Line-Archaeol Museum/Knossos Palace-Private Guided Tour,"Crete, Greece"
Cave of Zeus & Knossos Palace with Lassithi Plateau from Rethymno,"Crete, Greece"
Private Transfer - Chania Airport (CHQ) to Heraklion Cruise Port,"Crete, Greece"
Private Dufur 32 Luxury Escape Sailing,"Crete, Greece"
Creta Private Transfer from Heraklion (HER) Airport to Kokkini Hani,"Crete, Greece"
Private Helicopter Transfer from Chania to Mykonos,"Crete, Greece"
Full-Day Private Samaria Tour From Rethymno,"Crete, Greece"
Explore Ancient Aptera and taste Cretan wine at Dourakis Winery.,"Crete, Greece"
Creta Private Transfer from Heraklion (HER) Airport to Fodele,"Crete, Greece"
Private Morning Catamaran Experience from Hersonissos,"Crete, Greece"
Creta Private Transfer from Heraklion (HER) Airport to Máleme,"Crete, Greece"
Private Day Tour to secret destinations from Chania - Max 6 travelers,"Crete, Greece"
Luxury AZIMUT 44 ft Yacht Cruise,"Crete, Greece"
Transfer Airport to HERAKLION CITY CENTER OR PORT area up to 7,"Crete, Greece"
Private Transfer from Bali to Sitia (JSH) Airport,"Crete, Greece"
ZOURVA toTROMARISSA adventure,"Crete, Greece"
Cooking in Ancient Greece,"Crete, Greece"
Cretan Picnic for Wine Lovers,"Crete, Greece"
Transfer Heraklion Airport to ANISSARAS area up to 7 customers,"Crete, Greece"
Explore Knossos and Free Time in Heraklion City - Crete,"Crete, Greece"
Crete Private Transfer from Gournes city to Heraklion (HER) Airport,"Crete, Greece"
License Free Boat Rental in Kolimvari (30-hp engine),"Crete, Greece"
Private Catamaran Trip to Island Dia from Heraklion,"Crete, Greece"
Private Helicopter Transfer from Crete to Athens,"Crete, Greece"
Private Transfer in Crete,"Crete, Greece"
Private Woodturning Workshop,"Crete, Greece"
Heraklion's Historical Treasures: A Self-Guided Audio Tour in Crete,"Crete, Greece"
Crete Private Taxi and Transfer from Chania to Sfakia,"Crete, Greece"
Crete Private Transfer from Agia Marina city to Heraklion (HER) Airport,"Crete, Greece"
Via Ferrata in Crete at Asterousia Mountains,"Crete, Greece"
Private Transfer from Sisi to Sitia (JSH) Airport,"Crete, Greece"
Private Transfer from Rethymno to Heraklion airport,"Crete, Greece"
Private Transfer from Heraklion Airport to Makrygialos,"Crete, Greece"
Crete Private Transfer from Bali city to Heraklion (HER) Airport,"Crete, Greece"
"Full Day Private Tour to Chania, Kournas and Rethymno","Crete, Greece"
Crete Private Transfer from Eloúnda city to Chania (CHQ) Airport,"Crete, Greece"
Transfer Heraklion Airport to FODELE area up to 7 customers,"Crete, Greece"
Crete Private Transfer from Malia city to Chania (CHQ) Airport,"Crete, Greece"
Private Helicopter Transfer from Crete to Mykonos,"Crete, Greece"
Transfer from Chania airport to Agia Marina up to 3 customers,"Crete, Greece"
"Guided tour ""Love stories of Elounda""","Crete, Greece"
"Sfakia, Frangokastelo & Vrysses - Private Tour with snacks","Crete, Greece"
Private Half Day Fishing in Agios Nikolaos,"Crete, Greece"
Crete Private Transfer from Ammoudara city to Chania (CHQ) Airport,"Crete, Greece"
"Full Day Richti Waterfall, Mohlos Beach, Azoria Olive Tree","Crete, Greece"
Fun Walking Tour & Food Tasting in Heraklion,"Crete, Greece"
Safari V.I.P. Full-Day Tour of Southern Crete with Lunch from Heraklion,"Crete, Greece"
"Transfer to Chania Airport from Heraklion, Rethimno or Chania","Crete, Greece"
Full Day Tour in Preveli Palm Beach and Rethimno with Lunch box,"Crete, Greece"
Private Transfer from Sitia (JSH) Airport to Sitia City,"Crete, Greece"
Van Tour on the Countryside of Chania,"Crete, Greece"
Half-Day Private Hiking Tour to the Akrotiri Peninsula,"Crete, Greece"
Gramvousa Island and Balos Lagoon Day Tour from Rethimno,"Crete, Greece"
Private Transfer from Sitia (JSH) Airport to Makrí Gialós,"Crete, Greece"
Chania Guided Walking Food Tour,"Crete, Greece"
"Lasithi, Knossos & Cave of Zeus Tour From Heraklion","Crete, Greece"
Full Day Guided Eco and Nature Tour in Crete,"Crete, Greece"
Crete Private Transfer from Sitia city to Heraklion (HER) Airport,"Crete, Greece"
Private Transfer from Georgioupoli to Sitia (JSH) Airport,"Crete, Greece"
"Heraklion: Knossos Palace, Archaeological Museum, Wine Tasting","Crete, Greece"
Paths of Old Cretan Life. Private tour from Chania.,"Crete, Greece"
Calling From Crete: Live Greek Island Cooking Class,"Crete, Greece"
Private Transfer from Koutsounari to Sitia (JSH) Airport,"Crete, Greece"
Private Transfer from Sitia (JSH) Airport to Panormos,"Crete, Greece"
Transfer Heraklion Airport to ELOUNTA area up to 7 customers,"Crete, Greece"
Elafonisi,"Crete, Greece"
"Private tour from Rethymno: Heraklion, Knossos, Melidoni cave","Crete, Greece"
Creta Private Transfer from Heraklion (HER) Airport to Karteros,"Crete, Greece"
Transfer Heraklion Airport to RETHIMNO CITY area up to 7,"Crete, Greece"
Private Transfer from Sitia (JSH) Airport to Agia Marina,"Crete, Greece"
One-Way Shared Transfer To/From Chania Air-Georgioupolis/Kavros,"Crete, Greece"
Crete Private Taxi Transfer from Heraklion Airport to Bali,"Crete, Greece"
Private Transfer from Sitia (JSH) Airport to Koutsouras,"Crete, Greece"
Private Transfer from Kalo Chorio to Sitia (JSH) Airport,"Crete, Greece"
V.I.P. Safari Agiofarago - Matala,"Crete, Greece"
Giouhtas Mount Trekking,"Crete, Greece"
