Attraction,City
Traditional villages of Chania Private Tour to Explore pure Crete,"Crete, Greece"
"15 Days Relaxing Tour to Milos, Mykonos, Santorini & Athens","Crete, Greece"
Private Transfer Port/Airport to/from Ierapetra,"Crete, Greece"
Scuba Private Experience for beginners,"Crete, Greece"
Transfer Heraklion Airport to MATALA area up to 7 customers,"Crete, Greece"
4-Hour Giouchtas Trekking Hiking Experience from Heraklion,"Crete, Greece"
Full day Samaria Gorge Tour from Chania Through Easy Way,"Crete, Greece"
Full-Day Private Guided Tour from Rethymno,"Crete, Greece"
Creta Private Transfer from Chania (CHQ) Airport to Gournes,"Crete, Greece"
Chania Private Tour To Balos Lagoon and Gramvousa Peninsula,"Crete, Greece"
Herakleion City Self-Guided Game & Tour,"Crete, Greece"
Private Photo Session with a Local Photographer in Crete,"Crete, Greece"
Full Day tour Rethymnon Chania Lake Kournas,"Crete, Greece"
Private Transfer from Chania to Sitia (JSH) Airport,"Crete, Greece"
Private Yacht Cruise in Rethymno,"Crete, Greece"
Private Taxi & Transfer from Chania to Hersonissos in Crete,"Crete, Greece"
Crete Private Transfer from Lygaria city to Chania (CHQ) Airport,"Crete, Greece"
Rethymno Barbarossa Pirate Ship Mini - Cruise,"Crete, Greece"
Crete Private Transfer from Palekastro city to Heraklion (HER) Airport,"Crete, Greece"
Tango Lessons in Chania Area,"Crete, Greece"
Private 6-day tour in the Peloponnese - See 1st capital of Greece,"Crete, Greece"
Private Transfer from Elounda to Heraklion Airport,"Crete, Greece"
Private Tour from Elounda to Zeus Cave - Lasithi Plateau and more,"Crete, Greece"
Private Transfer from Sfakaki to Sitia (JSH) Airport,"Crete, Greece"
Spend Amazing time Being a Cretan for One Day- crete,"Crete, Greece"
Crete Private Transfer from Sissi city to Chania (CHQ) Airport,"Crete, Greece"
Wine Tasting Experience of Cretan Wines with a Wine Pro,"Crete, Greece"
Shared Falassarna Beach Tour Visit from Rethymno,"Crete, Greece"
Private Transfer from Sitia (JSH) Airport to Eloúnda,"Crete, Greece"
Private Transfer from Sitia (JSH) Airport to Sisi,"Crete, Greece"
Rethymnon Sunset Cruise with a Pirate Boat,"Crete, Greece"
Knossos: Archaeological Site Admission Ticket,"Crete, Greece"
A lunch tasting dining experience of traditional Cretan food!,"Crete, Greece"
Private Safari Jeep in Mykonos,"Crete, Greece"
Heraklion: Half Day Small Group Wine Tour with wine Tastings,"Crete, Greece"
Agia Irini Gorge and Sougia Beach Tour,"Crete, Greece"
Full Day Elafonissi Beach & Honey Tour,"Crete, Greece"
Mythical Escape: Zeus Cave & Knossos Palace with Lassithi Plateau from Elounda,"Crete, Greece"
Messara,"Crete, Greece"
Creta Private Transfer from Chania (CHQ) Airport to Fodele,"Crete, Greece"
Private Helicopter Transfer from Crete to Santorini,"Crete, Greece"
"Cretan Night Music, Food & Dancing","Crete, Greece"
"Hobby shop, Art workshop with seminars","Crete, Greece"
Lake Kournas Pedal Boat Tour with Transfer,"Crete, Greece"
Private 6.5h shore tour to Eastern Crete from Heraklion,"Crete, Greece"
Private Hiking tour in Gramvousa Peninsoula from Kissamos,"Crete, Greece"
Elafonisi Private Escape Luxury Day Tour from Rethymno,"Crete, Greece"
Gramvousa and Balos Tour From Heraklion,"Crete, Greece"
Full Day Limnoupoli Waterpark Admission with Transfer,"Crete, Greece"
Elafonissi Beach and Balos From Rethymno,"Crete, Greece"
Private Sunset Tour and Dinner at Falassarna Beach,"Crete, Greece"
From Chania to Kalypso Beach Private Tour of the Crete Paradise,"Crete, Greece"
Chania City Evening Tour From Rethymno,"Crete, Greece"
Crete Private Taxi and Transfer Georgioupoli to Heraklion Airport,"Crete, Greece"
Lagoon Balos and Gramvousa Island Private-Sailing with Lunch,"Crete, Greece"
Chania Afternoon Catamaran Cruise with Dining,"Crete, Greece"
Discover Chania's Hidden Charms: Private Tour from Rethymno.,"Crete, Greece"
Crete Private Transfer from Ammoudara city to Heraklion (HER) Airport,"Crete, Greece"
Private Transfer from Plakias to Sitia (JSH) Airport,"Crete, Greece"
Crete Private Transfer from Máleme city to Heraklion (HER) Airport,"Crete, Greece"
Chania Airport (CHQ) to/from Chania suburbs- ZONE 1 -up to 15 prs,"Crete, Greece"
Scuba Diving Experience from Plakias,"Crete, Greece"
Creta Private Transfer from Chania (CHQ) Airport to Stalís,"Crete, Greece"
Private Transfer from Sitia (JSH) Airport to Ierapetra,"Crete, Greece"
Private Transfer from Kalyves to Sitia (JSH) Airport,"Crete, Greece"
Private Walking Food Tour in Chania,"Crete, Greece"
Creta Private Transfer from Heraklion (HER) Airport to Kalo Chorio,"Crete, Greece"
Beach Day - Seitan Limania and Marathi beach.,"Crete, Greece"
Private Transfer from Sitia (JSH) Airport to Kalo Chorio,"Crete, Greece"
Private Transfer from Sitia (JSH) Airport to Koutsounari,"Crete, Greece"
Chania by Night. Cretan Wine at Sunset Late Afternoon Walk,"Crete, Greece"
Crete Private Transfer from Karteros city to Heraklion (HER) Airport,"Crete, Greece"
Private Transfer from Agios Nikolaos to Sitia (JSH) Airport,"Crete, Greece"
"Zeus Cave, Kera Monastery, and Lasithi Plateau: Private Tour from Chania","Crete, Greece"
Imbros Hiking and Sfakia Private Tour from Heraklion,"Crete, Greece"
Crete Private Transfer from Makrigialos city to Chania (CHQ) Airport,"Crete, Greece"
Superior Private Tour in Knossos Palace and Archaeological Museum of Heraklion,"Crete, Greece"
Crete Private Transfer from Heraklion to Hersonissos,"Crete, Greece"
Full Day Tour in Loutro,"Crete, Greece"
Venture Botanical Garden in Cretan with Olive Oil Tasting & Menus,"Crete, Greece"
Between the Myths & Locals: Zeus Cave & Lassithi Plateau Villages,"Crete, Greece"
Trekking and observation of vultures at Psiloritis Geopark,"Crete, Greece"
Creta Private Transfer from Heraklion (HER) Airport to Gerani,"Crete, Greece"
Creta Private Transfer from Chania (CHQ) Airport to Agia Pelagia,"Crete, Greece"
Cretan Night - Live Music and Dance,"Crete, Greece"
"Cruise to Chrissi Island with lunch included, and Ierapetra Town","Crete, Greece"
Private Transfer from Makrí Gialós to Sitia (JSH) Airport,"Crete, Greece"
Creta Private Transfer from Heraklion (HER) Airport to Plakias,"Crete, Greece"
Explore the Flavors of Crete,"Crete, Greece"
Full-Day Boat Private Tour to Balos Lagoon and Gramvousa Island,"Crete, Greece"
Creta Private Transfer from Heraklion (HER) Airport to Sitia,"Crete, Greece"
Heraklion Cultural and Tasting Walking Tour,"Crete, Greece"
Private Taxi and Transfer from Heraklion to Adelianos Kampos,"Crete, Greece"
PAHNES peak(2454 m) adventure.The hightest.,"Crete, Greece"
Transfer from Chania airport to Agioi Apostoli up to 3 customers,"Crete, Greece"
Private Guided Tour to Knossos Palace&Shopping in Heraklion City,"Crete, Greece"
Creta Private Transfer from Heraklion (HER) Airport to Ammoudara,"Crete, Greece"
VIP Private Transfer: Heraklion - Elounda Hotels & Villas,"Crete, Greece"
Chania Luxury Jeep Safaris: Manousakis Vineyard & Winery,"Crete, Greece"
Golf Cabriolet Rental in Rethimno,"Crete, Greece"
Samaria Gorge Trek: Full-Day Excursion from Heraklion,"Crete, Greece"
Transfer Heraklion Airport to Kolymvari area up to 7 customers,"Crete, Greece"
Chania Old Town and Cretan Landscape Tour (price per group of 6),"Crete, Greece"
Full-Day Private Samaria National Park Hiking Experience,"Crete, Greece"
Crete Private Transfer from Sfakiá city to Heraklion (HER) Airport,"Crete, Greece"
Crete Private Transfer from Agia Pelagia city to Chania (CHQ) Airport,"Crete, Greece"
Creta Private Transfer from Heraklion (HER) Airport to Panormos,"Crete, Greece"
Knossos palace (tour Guide+Transfer+Ticket),"Crete, Greece"
Creta Private Transfer from Chania (CHQ) Airport to Malia,"Crete, Greece"
Private Cretan Road Trip,"Crete, Greece"
Transfer Heraklion Airport to SISSI area up to 7 customers,"Crete, Greece"
"Exclusive Jeep Tour, South Crete, Winery, Donkeys, Secret Beach","Crete, Greece"
Private Airport Transfer from Chania Airport to Kolymbari,"Crete, Greece"
Private Selfie Tour in the Cultural Landmarks of Chania,"Crete, Greece"
Private Transfer from Paleochora to Sitia (JSH) Airport,"Crete, Greece"
Full-Day Trip to Santorini island by Boat from Ag.Nikolaos Elounda with Transfer,"Crete, Greece"
"Minoan Life: Knossos Palace, Olive Mill Visit, Lunch at Archanes","Crete, Greece"
Full Day Private East Crete Tour from Heraklion,"Crete, Greece"
Creta Private Transfer from Chania (CHQ) Airport to Plaka,"Crete, Greece"
SOUGIA-ARMOS-MAZA hike adventure,"Crete, Greece"
Beginner's SSI Intro dive w/2 Dives & transfer,"Crete, Greece"
Full Day Private Tour to Vai Palm Beach,"Crete, Greece"
Private 3-day tour in northern Greece - From Twelve to One God,"Crete, Greece"
Chania Luxury Jeep Safaris: White Mountains & Samaria Sightseeing,"Crete, Greece"
Heraklion Sherlock Holmes Murder Mystery Game,"Crete, Greece"
Creta Private Transfer from Heraklion (HER) Airport to Sissi,"Crete, Greece"
Crete Private Transfer from Fodele city to Heraklion (HER) Airport,"Crete, Greece"
Knossos Palace & Minoan Cooking Class Luxury Family Experience,"Crete, Greece"
Creta Private Transfer from Chania (CHQ) Airport to Palekastro,"Crete, Greece"
4 Days Venetian Crete from Heraklion,"Crete, Greece"
Private day tour from Chania to Akrotiri via Macherida,"Crete, Greece"
Transfer Heraklion Airport to Makris Gialos area up to 7,"Crete, Greece"
Private Transfer from Gerani to Sitia (JSH) Airport,"Crete, Greece"
Transfer Heraklion Airport to PLATANIAS CHANIA area up to 7,"Crete, Greece"
Private Catamaran Excursion From Hersonissos Port With Sunset,"Crete, Greece"
Rethymno Food Tastings & City Tour,"Crete, Greece"
"Luxe Sailing trip to Dia Island, Heraklion, Crete-max. 14 Guests","Crete, Greece"
West Crete Nature Private Tour with Lunch (price per group of 6),"Crete, Greece"
Creta Private Transfer from Heraklion (HER) Airport to Agia Pelagia,"Crete, Greece"
From Chania: Private Hire Minibus/Minivan & Driver,"Crete, Greece"
Crete Private Transfer from Kalo Chorio city to Chania (CHQ) Airport,"Crete, Greece"
Private Transfer from Sitia (JSH) Airport to Atsipopoulo,"Crete, Greece"
Full-Day Byron Shipwreck Dive for Certified Divers with Lunch,"Crete, Greece"
Full Day Tour Lasithi Plateau Zeus Cave and Knossos Palace,"Crete, Greece"
Transfer Heraklion Airport to IERAPETRA area up to 7 customers,"Crete, Greece"
Crete Private Transfer from Analipsis city to Chania (CHQ) Airport,"Crete, Greece"
"6-Hours Safari Tour in Damnoni and Skinaria Beach, from Plakias","Crete, Greece"
Chania Airport to Rethymno or Rethymno to Chania 8 Pax,"Crete, Greece"
1-Day Private Hiking in Lefka Ori,"Crete, Greece"
Private Transfer from Sitia (JSH) Airport to Xirokampos,"Crete, Greece"
Premium Wine Tour and Tasting at the Organic Winery in Crete,"Crete, Greece"
ANOPOLIS-LIVANIANA roundhike adventure,"Crete, Greece"
Domaine Paterianakis Organic wine tasting,"Crete, Greece"
Private Transfer from Sitia (JSH) Airport to Kato Zakros,"Crete, Greece"
Crete Private Transfer from Ferma city to Chania (CHQ) Airport,"Crete, Greece"
Traditional Cooking and Tasting in Rethymno Countryside,"Crete, Greece"
Land Rover Safari Katharo Route,"Crete, Greece"
Chania Luxury Jeep Safaris: Villages of Apokoronas & Profit Ilia,"Crete, Greece"
Porsche Speedster 356 Rental in Rethimno,"Crete, Greece"
Heraklion to Heraklion Airport (HER) - Departure Private Transfer,"Crete, Greece"
Transfer Heraklion Airport to Gouves area up to 7 customers,"Crete, Greece"
Half-Day Private Gorge Walking Adventure in Meskla,"Crete, Greece"
Private Transfer from Missiria to Sitia (JSH) Airport,"Crete, Greece"
Private tour Arkadi-Margarites-Melidoni cave from Rethymno,"Crete, Greece"
Creta Private Transfer from Chania (CHQ) Airport to Ferma,"Crete, Greece"
Uncharted East Crete & Local Secrets Private Tour from Chania,"Crete, Greece"
Between the Myths & Locals: Zeus Cave & Lassithi Plateau Villages,"Crete, Greece"
"Discover Crete: Wine, Honey, History, and Cuisine Private Tour","Crete, Greece"
Private Transfer from Agia Pelagia to Sitia (JSH) Airport,"Crete, Greece"
"PRIVATE Tour to Spinalonga-Elounda, Ag Nikolaos, Olive Oil Mill","Crete, Greece"
Chania Private SUV Wine and Olive Oil Tour,"Crete, Greece"
Diamantakis Private Winery Visit and Tasting of 6 Wine Labels,"Crete, Greece"
Crete Private Transfer from Sitia city to Chania (CHQ) Airport,"Crete, Greece"
Secrets of West Crete & Rethymno Town Private Tour from Elounda,"Crete, Greece"
Crete Private Transfer from Anissaras city to Chania (CHQ) Airport,"Crete, Greece"
Cretan Olive Oil Tasting and Food Pairing in Agia Varvara,"Crete, Greece"
Delicious Rethymno & Rural highlights,"Crete, Greece"
Palm Beach Preveli Day Experience from Rethymno,"Crete, Greece"
"Crete: Jeep Safari, Mountains, Goat-Keeping & Cheese Making","Crete, Greece"
Fabulous Christmas in Old Town Rethymno,"Crete, Greece"
Majestic Christmas Walking Tour in Heraklion,"Crete, Greece"
Magic Christmas tour in Elounda,"Crete, Greece"
"Taste of Crete - History, Food and Culture - 14 Day tour","Crete, Greece"
Seitan Limania - Marathi tour with SUP & lunch,"Crete, Greece"
Balos Private Tour with Lunch,"Crete, Greece"
Falasarna Beach Private Tour with SUP and Lunch,"Crete, Greece"
Crete: Private Private VIP Yacht Excursion-Explore/Swim-half day,"Crete, Greece"
Full-Day Mount Gigilos Hiking Tour from Bali Crete with Lunch,"Crete, Greece"
SOUTH CRETE TOUR up to 4 to 15 customers,"Crete, Greece"
Fabulous Christmas Tour in Old Town Rethymno,"Crete, Greece"
South Crete Tour,"Crete, Greece"
WEST CRETE LONG TRIP TOUR up to 4 to 15 customers,"Crete, Greece"
NORTH CRETE TOUR up to 4 customers,"Crete, Greece"
East Crete Around the Mountains Tour 4 to 15 customers,"Crete, Greece"
Transfer from Chania airport to Paleochora up to 3 or vise versa,"Crete, Greece"
