Attraction,City
"Full-Day Private Adventure: Knossos, Zeus Cave & Lassithi Plateau","Crete, Greece"
Sailing Cruise to Dia Island with Meal and Water Activities,"Crete, Greece"
Samaria Gorge Hiking from Chania,"Crete, Greece"
Day Tour to Santorini Island from Heraklion Crete,"Crete, Greece"
"Road-trip to Lasithi: Zeus Cave, Krasi, Vidiani&Olive Mill Farm","Crete, Greece"
Day Trip to Agios Nikolaos and Spinalonga Island,"Crete, Greece"
Santorini Island: Guided Tour From Heraklion Crete,"Crete, Greece"
Crete Jeep Safari to the south coast,"Crete, Greece"
Day Tour to Elafonisi Beach from Heraklion with Pickup Included,"Crete, Greece"
Full Day Hiking at Samaria Gorge&Agia Rumeli Beach from Heraklion,"Crete, Greece"
"Original Crete: Kourtaliotis Gorge, Preveli, Plakias, Argyroupoli","Crete, Greece"
Explore Chania's Old Town through the eyes of a local,"Crete, Greece"
West Crete Tour from Heraklion: Rethymno-Chania-Kurnas,"Crete, Greece"
"RENT A BOAT 5,5m-30hp LICENCE FREE MARATHI","Crete, Greece"
Cooking Class and Meal at our Family Olive Farm (the Cretan Vibes Farm)!,"Crete, Greece"
Walking “Food tasting tour” in the town of Chania,"Crete, Greece"
"Sea Kayaking Sfakia, Crete","Crete, Greece"
Private Rethymno Oil and Honey Tasting Pottery at Margarites,"Crete, Greece"
Heraklion: Nature Reserve Full day sailing to Dia Island & Lunch,"Crete, Greece"
Knossos palace and Heraklion city walking food tour (small group),"Crete, Greece"
"Cruise to Spinalonga, Kolokytha Bay&Agios Nikolaos.Lunch included","Crete, Greece"
Sailing Trips with Cretan Sailing,"Crete, Greece"
Zeus Cave-Traditional-Villages-Old Wind Mills-Olive Oil Factory-Small Group.,"Crete, Greece"
Half-Day Rethymno Quad Safari,"Crete, Greece"
Knossos Palace Skip-the-Line Ticket (Shared Tour - Small group),"Crete, Greece"
4 Hour Fishing Trip in Heraklion,"Crete, Greece"
The Real Cretan Cooking Experience,"Crete, Greece"
"Private Full-Day Adventure: Knossos, Museum & Melidoni Cave","Crete, Greece"
Spinalonga and Milatos Cave Safari Excursion & private Speedboat),"Crete, Greece"
Explore the White Mountains of Crete,"Crete, Greece"
Rethymno Walking & Gastronomy Tour,"Crete, Greece"
Full-Day Private Custom Tour to Elafonisi the Pink Sand Beach,"Crete, Greece"
"Richtis Waterfall, Minoan History, Oldest Tree, North Coast (Luxury Adventure)","Crete, Greece"
Gramvousa and Balos Tour from Chania(Boat ticket is included!),"Crete, Greece"
Elafonisi Full-Day Tour from Chania,"Crete, Greece"
Private Tour - Wine Olive Oil Tasting and Pottery in Heraklion,"Crete, Greece"
Hop-On Hop-Off Sightseeing Bus Tour in Heraklion,"Crete, Greece"
"Combo Tour: Knossos&Lasithi Plateau,Cave of Zeus&Olive mill Farm","Crete, Greece"
Sea Kayak & Snorkel tours in West Crete,"Crete, Greece"
Elafonissi Beach Trip from Chania,"Crete, Greece"
Full-Day 4x4 Self-Drive Safari in Crete with Lunch,"Crete, Greece"
Luxury Sailing escape shared,"Crete, Greece"
Spinalonga & Agios Nikolaos from Heraklion region,"Crete, Greece"
River Trekking Adventure in Crete at Kourtaliotis Gorge,"Crete, Greece"
Guided Tour to Knossos Palace & Heraklion,"Crete, Greece"
Knossos - Lassithi,"Crete, Greece"
Quad Safari Off-Road Tour,"Crete, Greece"
Daily Cruise - Koufonissia & Rina Cave,"Crete, Greece"
Full Day Trip to Spinalonga Zeus Cave and olive oil factory,"Crete, Greece"
South Crete: Matala Hippies Beach & Gortys Archaeological Site,"Crete, Greece"
Full-Day Private Tour to Balos Lagoon and Falassarna,"Crete, Greece"
VIP Luxury Private Tour- Half Day - 4x4 Excursion with Land Rover,"Crete, Greece"
"Samaria Gorge- the long way, from Chania","Crete, Greece"
Half-Day Small-Group Boat Safari in Crete,"Crete, Greece"
"Full Day Tour in Knossos palace,Lassithi Plateau and Zeus Cave","Crete, Greece"
VIP Luxury Private Tour - Full Day - 4x4 Excursion with Land Rover,"Crete, Greece"
Private Full-Day East Crete Tour from Heraklion,"Crete, Greece"
Small-Group Old City and Harbor Segway Tour in Chania,"Crete, Greece"
Historical Heraklion City Tour with Knossos Palace & Old Market,"Crete, Greece"
Knossos Palace and Plateau of Lassithi from Heraklion Region,"Crete, Greece"
White Mountains - Semi Private Safari Tour with Tastings & Lunch,"Crete, Greece"
Trypiti beach and gorge Jeep Safari,"Crete, Greece"
Balos Sailing Cruises shared in small group,"Crete, Greece"
4x4 self drive adventure,"Crete, Greece"
Authentic Wine & Food Tastings - PRIVATE Walking Tour with Lunch,"Crete, Greece"
Balos & Falassarna Beach - Jeep Tour with Loungers and Lunch,"Crete, Greece"
Sailing in South Crete with transfer from Matala & Ag. Galini,"Crete, Greece"
"Unique Minoan Crete: Zeus Cave, Winery Visit, Knossos Palace","Crete, Greece"
Heraklion | Half day Sailing cruise to Dia Island,"Crete, Greece"
"Sunset cruise - yachting tour on catamaran Heraklion, Crete","Crete, Greece"
Semi Private Wine and Olive Oil tour (Transfer & Lunch Incl.),"Crete, Greece"
The 7 Villages of Apokoronas Tour – Explore East Chania Mainland,"Crete, Greece"
Chania Cooking Class-The Authentic Enjoy traditional Cretan meal,"Crete, Greece"
Paragliding Tours in Crete,"Crete, Greece"
Full-Day Small-Group Tour in Crete,"Crete, Greece"
The Palace of Knossos with Optional Skip-the-Line Ticket,"Crete, Greece"
Sarakina Gorge & High Mountains & South Coast & (Luxury Adventure),"Crete, Greece"
Sunset Craft Beer & Food Tour - Chania,"Crete, Greece"
Full-Day West Crete Tour: Chania & Rethymnon Old Town and Kournas Lake,"Crete, Greece"
Rethymno Land Rover Safari with Lunch and Drinks,"Crete, Greece"
Experience Scuba Diving in Heraklion Crete,"Crete, Greece"
Santorini Full day Tour from Heraklion,"Crete, Greece"
Gramvousa Island and Balos Bay Full-Day Tour from Heraklion,"Crete, Greece"
CRETAquarium Entrance Ticket in Crete,"Crete, Greece"
Cooking experience in the most beautiful garden near Rethymno,"Crete, Greece"
Troy Dinner-Show,"Crete, Greece"
Quad Safari Off-Road Evening Tour,"Crete, Greece"
Battle of Crete Full Day Private Tour in Chania,"Crete, Greece"
Heraklion for Foodies Tour: Private Culinary Experience,"Crete, Greece"
Samaria Gorge Trek: Full-Day Excursion from Chania,"Crete, Greece"
"Truffle Hunting, Culinary & Wine Celebration from Heraklion","Crete, Greece"
The Gourmet Wine Tour of Heraklion area,"Crete, Greece"
Georgioupolis Safari Off Road Tours Outdoor Activities Land Rover Defender,"Crete, Greece"
Hike Imbros gorge & explore Sfakia with lunch,"Crete, Greece"
Elafonissi Beach from Rethymno,"Crete, Greece"
"Private Tour Rethymno: Spili, Preveli, Kourtaliotiko, Old Town","Crete, Greece"
"Wine, Olive Oil, and Honey Tour with Winemaker","Crete, Greece"
Quad ATV Safari from Georgioupolis Area,"Crete, Greece"
Knossos Palace & Archeological Museum: E-Tickets with Audio Tours,"Crete, Greece"
E-bike Food Tour Tasting in Heraklion,"Crete, Greece"
Half Day 55 Km Quad Safari Rethymno Crosscountry Experience,"Crete, Greece"
Semi-Submarine Tour from Agios Nikolaos,"Crete, Greece"
Quad bike tour,"Crete, Greece"
"Minoan Crete: Knossos Palace, Winery Visit and Lunch at Archanes","Crete, Greece"
Heraklion: Cretan private cooking lesson with lunch in Arolithos,"Crete, Greece"
Jeep Exploring Mainland,"Crete, Greece"
Samaria Gorge Hike from Heraklion region,"Crete, Greece"
"Tour to Sitia, Toplou Monastery and Vai Palm Beach from Ierapetra","Crete, Greece"
Gramvousa Island & Balos Lagoon,"Crete, Greece"
Private Full-Day Knossos-Lasithi Plateau-Cave of Zeus from Elouda,"Crete, Greece"
Chrysoula's Traditional Cretan Home Cooking,"Crete, Greece"
Private Full-Day Knossos-Lasithi Plateau-Cave of Zeus,"Crete, Greece"
Chania & Kournas Lake From Rethymno,"Crete, Greece"
4x4 Safari Tour South Crete Agiofarago Matala,"Crete, Greece"
Skip the Line - Private Tour to Knossos Palace and Zeus Cave,"Crete, Greece"
Create your own Traditional Cretan Soap,"Crete, Greece"
Hersonissos Sunset Catamaran Cruise with finger food & drinks,"Crete, Greece"
South Crete - Matala + Hippie caves direct,"Crete, Greece"
Rethymno & Kournas Lake - Private Tour from Chania,"Crete, Greece"
Chania Old Town Private Tour with pick up (price per group of 6),"Crete, Greece"
"Day Private Sailing Cruises to Balos Lagoon, Gramvousa Island and more.","Crete, Greece"
Private Segway Tour of Rethymno,"Crete, Greece"
Milia Mountain-Safari tour with Wine - Olive Oil Tastings & Lunch,"Crete, Greece"
Elafonisi & Milia Mountain - Jeep Tour with Loungers and Lunch,"Crete, Greece"
Preveli Beach and Plakias Full-Day Trip From Rethymno,"Crete, Greece"
Olive Oil Tasting Tour,"Crete, Greece"
Chania to Elafonisi Beach and Traditional Villages Private Tour,"Crete, Greece"
Heraklion: Scuba Diving Experience for Beginners w/transfer,"Crete, Greece"
Knossos and Heraklion City from Rethymno,"Crete, Greece"
Cave Of Zeus,"Crete, Greece"
Cretan Night Show Tour From Rethymnon,"Crete, Greece"
Cretan Gastronomy Lessons,"Crete, Greece"
Pottery Village of Margarites - The monastery of Arkadi & The Gorge of Patsos,"Crete, Greece"
Discover South Crete from Rethymnon - follow the tradition,"Crete, Greece"
"Chania, Kournas and Rethymno from Heraklion Private Tour","Crete, Greece"
Knossos & Archaeological Museum Shared Guided Tour from Chania,"Crete, Greece"
"River Trekking at Kourtaliotiko Gorge, Rethymno-Crete","Crete, Greece"
Knossos-Arch.Museum-Heraklion City - Full Day Private Tour from Chania,"Crete, Greece"
Your Tailored Elafonisi Escape. Luxury Day Tour from Heraklion.,"Crete, Greece"
Your Tailored Elafonisi Escape. Luxury Day Tour from Chania.,"Crete, Greece"
"Crete Culinary Journey: Olives, Raki, Archanes Feast Delights","Crete, Greece"
Eleftherna E-Bike and MTB Tour - Experience The Authentic Crete,"Crete, Greece"
Knossos Private Full-Day Tour from Heraklion with Pick Up,"Crete, Greece"
Knossos Palace & Heraklion City Tour,"Crete, Greece"
Sailing day on the island of Dia with departure from Heraklion,"Crete, Greece"
The Delicious Chania PRIVATE Street Food Tour,"Crete, Greece"
Elafonisi Beach Private Tour (price per group of 6),"Crete, Greece"
Wine Tasting Experience @ Lyrarakis Winery (Transfer Included),"Crete, Greece"
Eat & Crete - Food Tour [out of the box]- Chania White Mountains,"Crete, Greece"
Beer Bike 1 hour Experience in Malia,"Crete, Greece"
Full Day Samaria Gorge 10-Mile Walking Tour,"Crete, Greece"
Entry E-Ticket to Heraklion Archaeological Museum with Audio,"Crete, Greece"
Small-Group Segway Chania Old City and Harbor Combo Tour,"Crete, Greece"
"Comfort cruise - sailing catamaran trips from Heraklion, Crete","Crete, Greece"
Full-Day Santorini Island Trip from Crete,"Crete, Greece"
From Heraklion: Small Group 6h Sunset Sailing Trip to Dia Island,"Crete, Greece"
An audio tour of Rethymno: From Ancient Greece to modern times,"Crete, Greece"
Small-Group Wine Tasting Activity in West Chania,"Crete, Greece"
Wine and Olive oil Tasting,"Crete, Greece"
Cretan stories: when craft meets history...From Rethymno,"Crete, Greece"
Spinalonga Regular Trip -daily At 12:30 From Agios Nikolaos,"Crete, Greece"
Chania's Turbulent History: A Self-Guided Audio Tour of it's Old Town,"Crete, Greece"
Preveli Palm Beach Boat Cruise & Rethymnon Town from Heraklion,"Crete, Greece"
Minoans World 3D Museum & 9D Cinema,"Crete, Greece"
In Crete Discover the miracle of Olive Oil and Organic Fruits,"Crete, Greece"
Skip the Line: Aquaplus Admission Ticket,"Crete, Greece"
"Elafonisi Beach: Welcome to paradise, From Rethymnon","Crete, Greece"
Crete White Mountains Safari Including Lunch,"Crete, Greece"
Stand-up Paddleboard Lazareta Experience Chania Crete (tour),"Crete, Greece"
Beer Tasting & Guided Brewing Tour,"Crete, Greece"
Full-Day Gramvousa and Balos Tour from Rethymno,"Crete, Greece"
Boat Trip with Guided Snorkeling Tour & SUP in Chania,"Crete, Greece"
Sailing trip to the Top Coasts of Crete,"Crete, Greece"
Small-Group Honey & Extra Virgin Olive Oil Tasting Tour in Crete,"Crete, Greece"
Heraklion: Visit A Family-Run Olive Mill With Food Pairing,"Crete, Greece"
Small Villages and Cretan Nature. E-Bike tour with Cretan Brunch,"Crete, Greece"
Katharo Route Tour from Agios Nikolaos,"Crete, Greece"
Full-Day Jeep Safari Tour with Cooking Lesson,"Crete, Greece"
Chania White Mountains Private Tour: From Sea to Summit!,"Crete, Greece"
Ecobike tour in historic Heraklion,"Crete, Greece"
Private Boat Trip Sfakia - Domata (price per Group of 9),"Crete, Greece"
Matala - Agia Galini - Spili from Rethymno,"Crete, Greece"
Wine Tasting: Meet the Cretan Vineyard at West Chania,"Crete, Greece"
Private Sail in Chania,"Crete, Greece"
Private Wine and Olive Oil Tour with Wine Professional,"Crete, Greece"
SAMARIA GORGE: One of the most important in Europe From Rethymnon,"Crete, Greece"
The Cretan Way of Life at the mountains of Rethymno (Mylopotamos),"Crete, Greece"
Chania Cooking Class - Kalitsoyni Workshop,"Crete, Greece"
Craft Beer City Tour - Rethymno Old Town,"Crete, Greece"
Try Scuba in Crete (For beginners),"Crete, Greece"
"Private Full-Day Adventure: Preveli, Waterfalls & Kalypso Beach","Crete, Greece"
All Inclusive Full-day Private Tour of Crete Villages from Chania,"Crete, Greece"
Jeep Safari Wine Tour and South sea swimming,"Crete, Greece"
Crete: Hot air balloon ride in mini-group,"Crete, Greece"
Ecobike Wine Tasting Tour in Heraklion,"Crete, Greece"
"Rock Climbing in Crete with a Guide in Rethymnon, Plakias beach","Crete, Greece"
Private Boat Tours in Kalyves and East Coast,"Crete, Greece"
Private half day Wine and Olive oil tasting-Kournas lake,"Crete, Greece"
Rethymno Cycling Tour,"Crete, Greece"
Boat Trip to Seitan Limania creek for up to 5 people 4hrs!,"Crete, Greece"
4-Hour Private Boat Rental Without Skipper at Agios Nikolaos,"Crete, Greece"
Amazing Safari tour Lasithi Plateau pick up and drop off,"Crete, Greece"
Chania Old Town Trikke Tour- A Journey through the Centuries,"Crete, Greece"
Accessible to wheelchair Sightseeing tour to Knossos palace,"Crete, Greece"
Ecobike Tour • All in One • Historical Tour-Food Tasting-Wine Tasting,"Crete, Greece"
Mykonos Private Island Tour,"Crete, Greece"
Walk through Samaria Gorge,"Crete, Greece"
"Sunset - sailing cruise on yacht catamaran, Rethymno, Crete","Crete, Greece"
Authentic Olive Oil and Cultural Experience in Crete,"Crete, Greece"
PRIVATE Jeep Safari 4x4 SUNSET Area Heraklion with Dinner,"Crete, Greece"
Discover the local Agro life- Food tour with Cretan Vibes,"Crete, Greece"
Chania city from Rethymno,"Crete, Greece"
"The Best of 12-Day Tour, Athens, Delphi-Meteora, Santorini, Crete","Crete, Greece"
Agios Nikolaos Morning Catamaran Cruise in Mirabello with Lunch,"Crete, Greece"
Heraklion Private Half-Day Gastronomy Diaries Experience in Lyrarakis Winery,"Crete, Greece"
"E-Bike Tour with Wine Tasting in Dafnes, Heraklion","Crete, Greece"
Olous – Guided Snorkelling Excursion to Discover Olous Sunken Ancient City,"Crete, Greece"
"Pallada Semi-Private Olive Oil Tours in Sternes, Chania","Crete, Greece"
Private Elafonisi Tour from Chania,"Crete, Greece"
Half-Day Georgioupolis Off-Road Adventure with Meal,"Crete, Greece"
Heraklion Private Half-Day Wine Tasting Tour in Lyrarakis Winery,"Crete, Greece"
"WALK -VOΛTA , Musical Narrative Walk in Rethymno","Crete, Greece"
"Private fishing trip Chania, Crete (price is per group)","Crete, Greece"
"Private Full-Day Knosos, Lasithi Plateau, Cave of Zeus from Rethimno","Crete, Greece"
Rock Climbing in Crete with a Guide in Heraklion,"Crete, Greece"
Full-Day Private Chania Wine Tour and Lunch In The Mystic Cellar.,"Crete, Greece"
Wine Tasting in Rethymno,"Crete, Greece"
From Heraklion: Chania - Rethymno - Argiroupolis - Kournas Lake,"Crete, Greece"
Cretan Flavours - Cooking Lessons in Heraklion - Small Group,"Crete, Greece"
Mythical Escape: Cave of Zeus & Knossos Palace with Lassithi Plateau from Chania,"Crete, Greece"
Beginner Diving Experience in Ligaria Bay,"Crete, Greece"
Knossos Private Guide,"Crete, Greece"
Chania Combo Tour,"Crete, Greece"
Private Full Day Sailing Trip to Dia Island,"Crete, Greece"
Elafonisi Beach Full Day Private Family Tour,"Crete, Greece"
Cretan Wines & Olive oil tour - The treasures of Crete,"Crete, Greece"
Knossos Palace and Arch. Museum of Heraklion Tour,"Crete, Greece"
Private Wine Tasting & Lunch @ Lyrarakis Winery - Transfer Inclu,"Crete, Greece"
Imbros Gorge - War Museum Askifou - Iligas Beach Private Tour,"Crete, Greece"
Your Tailored Elafonisi Escape. Luxury Day Tour from Elounda.,"Crete, Greece"
Unknown Crete -sarakina Gorge,"Crete, Greece"
Wine Tasting-Olive Oil Factory-Traditional Villages- Small Group,"Crete, Greece"
On the trail of the Greek Mythology,"Crete, Greece"
Crete Pirate Ship Cruise with the Black Rose to Stalis and Malia,"Crete, Greece"
Picturesque Western Crete In Mini Group,"Crete, Greece"
Private Jeep Tour - Zeus Cave - Cretan villages,"Crete, Greece"
South Crete: Matala Beach & Ancient Gortyn,"Crete, Greece"
Private Boat Trip from Rethymno Old Harbour,"Crete, Greece"
Mirabello Luxuries with Spinalonga & Agios Nikolaos from Iraklion,"Crete, Greece"
Authentic Crete Heart of the island,"Crete, Greece"
Kissamos: Greek Night Experience with Dancing and Buffet Dinner,"Crete, Greece"
"Full-day Apokoronas Culture, Cuisine and Wine Tour from Chania","Crete, Greece"
Monastery - Ancient Olive tree & Museum-Cretan Brewery Private Tour from Chania,"Crete, Greece"
Rethymnon Olive Tree Sponsorship Protect and Plant Tour,"Crete, Greece"
4x4 Safari tour Southern Crete Tripitis Gorge,"Crete, Greece"
"5Hour Safari Tour in Crete(Heraklion)with Quad,ATV Jeep,Buggy, Monster and Lunch","Crete, Greece"
Private Wine Tasting Experience @ Domaine Paterianakis (Free Transfer),"Crete, Greece"
Private River Trekking and Gorge Walking Adventure in Crete,"Crete, Greece"
Chania Segway Night Tour,"Crete, Greece"
"Chania Nature & Villages, White Mountains & Unique Cretan Lunch","Crete, Greece"
Crete: Private Taxi & Transfer from Rethymno to Chania,"Crete, Greece"
Landrover Safari Explore Shephard's Hut and Cheese Making Process,"Crete, Greece"
Knossos Palace Greek Mythology,"Crete, Greece"
Crete: Private Taxi & Transfer from Chania to Heraklion,"Crete, Greece"
Knossos Palace and Lasithi Plateau - Private Tour from Elounda,"Crete, Greece"
Tour of Crete (3 days private tour),"Crete, Greece"
Crete: Private Taxi & Transfer from Heraklion to Rethymno,"Crete, Greece"
Discover the unknown side of Crete by E-Bike,"Crete, Greece"
Cretan Cooking Class at a Farmhouse,"Crete, Greece"
Knossos Palace Self-Guided Treasure Hunt & Tour,"Crete, Greece"
From Rethymno: Full-Day Knossos And Heraklion with free time,"Crete, Greece"
Private Tour of Crete with Knossos Palace and Lassithi Plateau,"Crete, Greece"
Guided Tour in Knossos Palace,"Crete, Greece"
Agios Nikolaos - Elounda - Spinalonga island Day tour,"Crete, Greece"
"Chania Cooking Class in Crete with rustic, delicious and homely Cretan food!","Crete, Greece"
Full-Day Private Seitan Limani Boat Tour from Chania,"Crete, Greece"
Cooking class at the Shepherd's Shelter in Rethymno,"Crete, Greece"
"From Heraklion : Full-Day Bus Trip to Chania city , Kournas lake & Rethymno city","Crete, Greece"
Private Sailing Cruise to Dia Island with Meal & Water Activities,"Crete, Greece"
Chania: Archaeological Museum Skip-The-Line Ticket and audio tour on your phone,"Crete, Greece"
Spinalonga - Agios Nikolaos From Heraklion,"Crete, Greece"
Full-Day Hiking and Running Adventure in South Crete,"Crete, Greece"
Crete: Off-Road Quad Safari & Cave Exploring,"Crete, Greece"
Adventure Jeep Safari Amazing sunset,"Crete, Greece"
Olive Oil Cosmetic Factory- Spinalonga - Elounda - Agios Nikolaos,"Crete, Greece"
Full-Day Eco Bike Tour in Knossos Palace & Old Villages,"Crete, Greece"
Private Van Tour to Falassarna Beach from Chania,"Crete, Greece"
Taste of Crete with Trikke Ride,"Crete, Greece"
Rock Climbing Course,"Crete, Greece"
Private Tour to Lasithi Plateau-Traditional Villages-Zeus Cave,"Crete, Greece"
Vip Motor Yacht Charter-17 meter-10 Guest-Half day or Sunset trip,"Crete, Greece"
"Sea Kayaking Agia Galini, Crete","Crete, Greece"
Unique drone images of Crete and you from the air,"Crete, Greece"
"Private tasting of 6 cretan wines in Chania,Greece","Crete, Greece"
Knossos Palace & Heraklion Archaeology Museum | Private Tour,"Crete, Greece"
Crete: Taxi Transfers from Heraklion Airport to Rethymno City,"Crete, Greece"
Samaria Gorge Transfer from Chania (price per group of 6),"Crete, Greece"
Splantzia & Kum Kapi Tour,"Crete, Greece"
FISHING Trip 3h afternoon from Hersonissos,"Crete, Greece"
Private Hiking Tour in Imbros Gorge (Chania),"Crete, Greece"
Full Day Private Tour to the most Isolated Monastery of Crete,"Crete, Greece"
PRIVATE TOUR by 4x4 to Balos lagoon and Falassarna beach,"Crete, Greece"
Private Luxury Escape Sailing,"Crete, Greece"
"Chania town, mountains and restaurant Private Tour (group of 6)","Crete, Greece"
From Elounda: Chania - Rethymno - Argiroupolis - Kournas Lake,"Crete, Greece"
E-bike (Electric Bike) rental West Crete,"Crete, Greece"
From chania : Knossos Palace & Archeological Museum Tour,"Crete, Greece"
Good Morning Chania Bike Tour,"Crete, Greece"
Private Tour: Exploring Chania and its Villages,"Crete, Greece"
"Sea Kayaking Bali, Crete","Crete, Greece"
"Hydra, the Lordly Island of Senses prive","Crete, Greece"
Chania Town Food and Wine Tasting Walking Tour,"Crete, Greece"
Knossos & Authentic Crete with Local Experiences from Chania,"Crete, Greece"
Private - Guided Tour Heraklion Highlights & Historical Places,"Crete, Greece"
Private trip through heart of Crete & Wine Tasting from Heraklion,"Crete, Greece"
Hiking trip to Mount Psiloritis highest peak (2456m.) with Guide,"Crete, Greece"
Wine & Olive Oil tasting one day private tour in Crete,"Crete, Greece"
Wisdom of God cave - Elafonisi beach Private Tour,"Crete, Greece"
Knossos palace (Family friendly tour),"Crete, Greece"
Chania Old Town - Millennial Olive Tree - Olive Oil Mill,"Crete, Greece"
Full Day Rethimno Area,"Crete, Greece"
Private Tour: 4H Tour in Mykonos by Range Rover,"Crete, Greece"
6 Hour Hiking in Psiloritis Mountain,"Crete, Greece"
VIP Private Transfer: Heraklion - Analipsi Hotels & Villas,"Crete, Greece"
Labyrinth of Knossos (Shared Tour with Entry Tickets),"Crete, Greece"
Minoan Crete from 3.000 BC: Knossos Palace & Museum with Wineries from Chania,"Crete, Greece"
Psiloritis 6 hour hiking tour,"Crete, Greece"
We Fish & you Feast in Gramvousa & Balos Beach,"Crete, Greece"
Explore the Secrets of Wine and Olives in Chania,"Crete, Greece"
Full-Day Luxury Sailing Escape in Crete,"Crete, Greece"
Half Day Scuba Diving Experience in Plakias Greece,"Crete, Greece"
Heraklion Historic & Culinary Experience | Private Tour,"Crete, Greece"
Secrets of West Crete & Rethymno Town Private Tour from Chania,"Crete, Greece"
Chania Exploration Bike Tour,"Crete, Greece"
Gavdos Full Day Private Tour All Inclusive,"Crete, Greece"
Experience a 4 Hours Modern Via Ferrata,"Crete, Greece"
"Luxe Boat trip to Dia Island, Heraklion, Crete - max. 14 Guests","Crete, Greece"
SAMARIA GORGE adventure by local guide.,"Crete, Greece"
Walking Food Tasting Tour in Chania Town,"Crete, Greece"
Tour around crete in 4 days,"Crete, Greece"
1 hour and 30 minutes wines and olive oil tasting in Greece,"Crete, Greece"
Private: Jeep Safari in 2 Wineries and Samaria Gorge with Lunch,"Crete, Greece"
Private Guided Tour in Heraklion City and Knossos Palace,"Crete, Greece"
Private Dinner at Sunset and Cocktails,"Crete, Greece"
Crete: Transfer from Heraklion Airport to Rethymno up to 11 pasangers,"Crete, Greece"
From Crete: Santorini Day Trip by Boat with Oia & Fira Visit,"Crete, Greece"
"Chania Old Town, Public Market and Chrisopigi Monastery Tour","Crete, Greece"
Rouvas Gorge,"Crete, Greece"
2-hour Private Sunset Tour with Skipper in Agios Nikolaos,"Crete, Greece"
Hire a Licensed Tour Guide (Private Tour),"Crete, Greece"
Day Cruise to Gramvousa & Balos,"Crete, Greece"
From Heraklion & Malia: Cretan Folklore Night with Buffet,"Crete, Greece"
Private Tour Knossos & Heraklion City,"Crete, Greece"
Small Group Heraklion Segway Tour,"Crete, Greece"
PSILORITIS(mount Ida) Crete's Highest Point 2456m,"Crete, Greece"
Arkadi-ancient Eleftherna-margarites,"Crete, Greece"
5-Hour Snorkeling Experience in Kourtaliotiko Gorge Waterfalls,"Crete, Greece"
Plateau of Lassithi and Caves,"Crete, Greece"
Visit Knossos & Heraklion city (Walking and Tasting Tour),"Crete, Greece"
"""Full-Day Private Excursion to Hydra Island from Athens""","Crete, Greece"
Day Trip to Elafonisi Island From Chania,"Crete, Greece"
Crete Acqua Plus Water Park Entrance Ticket with Transport,"Crete, Greece"
Full-Day Kourna lake & Argyroupoli Crete Nature from Rethymno,"Crete, Greece"
Full Day Tour Samaria Gorge From Rethymno,"Crete, Greece"
Full-Day Trip to Santorini island by Boat from Rethymno with Transfer your Hotel,"Crete, Greece"
"SPINALONGA, Elounda, Kolokitha, Ag. Nicolaos","Crete, Greece"
Day Trip to Elafonisi Island From Rethymno English & German Guide,"Crete, Greece"
"Private Therisos, Zourva and Meskla Day Trip from Chania","Crete, Greece"
"Crete private tour: Knossos Palace, Archaeological museum, and Heraklion Town","Crete, Greece"
Limnoupolis Water Park All in,"Crete, Greece"
Samaria Gorge From Chania,"Crete, Greece"
Full-Day Trip to Santorini island by Boat from Heraklion,"Crete, Greece"
From Heraklion: Spinalonga Island BBQ and Agios Nikolaos ALL IN,"Crete, Greece"
Full Day Agios Nikolaos,"Crete, Greece"
Cretan History & Foodies Safari,"Crete, Greece"
"RIVIERA - Vai Palm Beach, Toplou Monastery","Crete, Greece"
WeGuide Knossos palace,"Crete, Greece"
Private transfer from Heraklion airport to Ag. Nikolaos,"Crete, Greece"
Private transfer from Heraklion airport to Chania,"Crete, Greece"
Gigilos summit adventure,"Crete, Greece"
South Round Trip - VIP Private Tour,"Crete, Greece"
Discover Scuba Diving in the sea with the Blue Dolphin Team,"Crete, Greece"
Crete: Private Taxi & Transfer from Chania to Rethymno,"Crete, Greece"
6.5 Western Crete Exploration Tour for Cruise Ships,"Crete, Greece"
Food Tasting Tour of Chania Villages,"Crete, Greece"
