Attraction,City
Kid Friendly Private Paris Louvre Tour with Tickets,"Paris, France"
Paris Segway Bachelor Party - Young Girl (EVG - EVJF),"Paris, France"
Gothic Paris - Castles & Cathedrals (Marais History Walk-Small Group Tour),"Paris, France"
Private one way transfer from Port Le Havre to Paris or back,"Paris, France"
La Defense Private Transfer to Airport or Central Paris,"Paris, France"
"Paris 10-Hour Private Louvre, Eiffel Tower & Seine River Cruise","Paris, France"
Loire Valley Private Day Trip with Chambord Winery Visit & Lunch,"Paris, France"
Private Airport Transfers To Paris - Arrival,"Paris, France"
Photograph with a pro Paris off the beaten path!,"Paris, France"
Full Day Private Tour in Paris,"Paris, France"
Paris Photo Shoot for Families and Couples,"Paris, France"
"2-day Mont Saint-Michel, D-Day Express, 3 Loire Castles Private","Paris, France"
Marché Madness,"Paris, France"
Private Tour to Paris Orsay Museum,"Paris, France"
Private Full-Day Tour of Champagne Region,"Paris, France"
Paris: get to know the city- self guided video audio tour,"Paris, France"
4-hour private tour Montmartre & Marais,"Paris, France"
Eiffel Tower Tour with Summit by Elevator and Seine Cruise,"Paris, France"
Full Day Private Tour In Paris With Hotel Pick Up,"Paris, France"
Boat Cruise River Seine Sightseeing and Guided Eiffel Tower Tour,"Paris, France"
A special evening in Paris,"Paris, France"
"Eiffel Tower Photographer, Professional Photo shoot - Paris","Paris, France"
Private Transfer from the City of Paris To Orly Airport (ORY),"Paris, France"
Self Guided Loire Valley Day Trip with Palace Entry Tickets,"Paris, France"
Eiffel Tower Summit Entry with Big Bus and Seine River Cruise,"Paris, France"
Private Street Art 2-Hour Guided Tour in Paris,"Paris, France"
MONT-ST-MICHEL and NORMANDY D-DAY: combined day-trip from PARIS,"Paris, France"
Day at Giverny Monet foundation & shopping at McArthurGlen Center,"Paris, France"
Paris Luxembourg Garden Wedding Vows Renewal Ceremony with Photo Shoot,"Paris, France"
Private Tour: D-Day Beaches from Paris,"Paris, France"
Louvre Skip the Line Private A La Carte,"Paris, France"
Eiffel Tower Timed Entrance Ticket SUMMIT Access by Elevator,"Paris, France"
One-hour Private Makeup Class with a Pro Makeup Artist,"Paris, France"
Private Tour to Mont St-Michel and Honfleur from Paris,"Paris, France"
Private Wine and Chocolate Tasting in Paris,"Paris, France"
Motorcycle rental A2 Tracer 7 Yamaha 2023 (A2 license) Paris,"Paris, France"
Transfer from Paris to Beauvais Airport,"Paris, France"
Inside Musée d'Orsay Discovery Private Tour,"Paris, France"
Private Car Trip to Giverny Garden from Paris,"Paris, France"
Private Full-Day Paris City Tour with Pickup,"Paris, France"
Paris Charles de Gaulle Airport Round Trip Transfer to/from Paris,"Paris, France"
Paris Airport CDG Round-Trip Private Transfers,"Paris, France"
Paris Saint-Germain Private Tasting Tour with Chocolate plus Pastries & Macaron,"Paris, France"
Paris - Private walking Food Tour Latin Quarter / Saint Germain,"Paris, France"
Paris' Best Kept Secrets With A Local Insider: Private & Personalized,"Paris, France"
Zoo Of Beauval - Private Trip,"Paris, France"
Champagne Tasting in Paris,"Paris, France"
The Paris of the Parisians,"Paris, France"
Paris Private Day Tour including Louvre Masterpieces Private Tour,"Paris, France"
"Private Tour: Les Invalides, Napoleon, and Musée Rodin Walking Tour","Paris, France"
Champagne & Terroir Treasures: Viator's Terroir Gourmet Delight,"Paris, France"
Paris Arc de Triomphe Entry and Mini Walking Tour,"Paris, France"
Paris Undercover,"Paris, France"
Private Tour of Montmartre in a Citroën Classic,"Paris, France"
Eiffel Tower Guided Tour - 2nd floor + optional Summit access,"Paris, France"
Eiffel Tower 2nd Floor Entry and Optional Seine River Cruise,"Paris, France"
Excursion to the Champagne region and Wine Tasting,"Paris, France"
The Incredible History of Le Marais Walking Tour - Semi-Private,"Paris, France"
Private Transfer from Paris to CDG and Orly Airport,"Paris, France"
Loire Valley Full-Day Private Guided Tour with Hotel Pickup,"Paris, France"
Explore Bohemian Montmartre: Private Half-Day Walking Tour,"Paris, France"
Return transfer from / to Paris Airport,"Paris, France"
Full-Day Private Sightseeing Tour of Paris (luxury van),"Paris, France"
Eiffel Tower Summit (All Floors) Guided Tour by Elevator Tickets.,"Paris, France"
Night Paris / duration 2h - from 1 to 6 passengers,"Paris, France"
Paris by Night Private illumination Tour Hotel pickup,"Paris, France"
Semi-Private French Revolution and Conciergerie tour,"Paris, France"
Paris in the Second World War: Private Half-Day Walking Tour,"Paris, France"
Private Macaron Making Class in a Traditional Parisian Apartment,"Paris, France"
"Private City-Tour by pedicab in Paris : The ""Gustave Eiffel""","Paris, France"
Best of Paris & A Walk in Montmartre-Full Day with Pickup/Dropoff,"Paris, France"
Loire Valley Castles and Wineries Private VIP Day Trip with Lunch,"Paris, France"
Private Transfer: Paris City to Paris Airport CDG by Two Vans,"Paris, France"
Versailles - Private full day tour from Paris,"Paris, France"
Private Roundtrip Transfer from Paris to Versailles,"Paris, France"
Explore Le Marais like a local - Private walking tour,"Paris, France"
Romantic Tour of Paris in Luxury Citroën DS with Open-roof,"Paris, France"
2 Hour Private Tour of Paris in a 67 Mustang Convertible,"Paris, France"
1:30 hours tour of Louvre museum,"Paris, France"
"Exquisite Wines Tasting Chateau Pommard, Chablis Small-Group trip","Paris, France"
Private transfer to Reims or Epernay : one way OR 8 hours tour,"Paris, France"
Giverny Private Tour: Monet's House & Garden,"Paris, France"
Private Drag Queen Cabaret Show with Wine Tasting in Paris,"Paris, France"
CHARMING PARIS: Half day guided visit and photo reportage,"Paris, France"
Semi-Private Père Lachaise Cemetery Tour,"Paris, France"
Paris and Parisians During WWII | Private Walking Tour,"Paris, France"
Workshop in Paris 100% Organic Lip Care,"Paris, France"
Paris to Versailles half day trip,"Paris, France"
"Chambord, Chenonceau and Amboise Private One-Day Tour from Paris","Paris, France"
Paris: The charm of Montmartre self-guided Video Audio Tour,"Paris, France"
Private Transfers: Paris - Airports / Paris - Disneyland,"Paris, France"
Impressionist Day At Giverny : Audio Guided Monet Foundation,"Paris, France"
"Private Champagne Moët & Chandon, Pommery, Pressoria from Paris","Paris, France"
Photoshoot by award winning filmmaker,"Paris, France"
Paris Illuminations Night Tour,"Paris, France"
Paris : Private Custom Walking Tour with a Local Guide,"Paris, France"
Private Transfer: Paris Airport CDG to Port of LE HAVRE in Business Car,"Paris, France"
Paris Photoshoot with Professional Photographer,"Paris, France"
Private Guided Tour in Champagne from Paris with Moet&Chandon visit.,"Paris, France"
Kid-Friendly Private Guided Tour of Versailles Palace & Gardens,"Paris, France"
Paris Seine River Marriage Proposal Cruise by Bateaux Mouches,"Paris, France"
Escape game Crypt,"Paris, France"
Shared Cheese Tasting with an Expert in Paris,"Paris, France"
Private Transfer for a memorable time in Paris,"Paris, France"
Private Breathtaking Climb to Eiffel Tower with a Local Guide,"Paris, France"
2-day Mont Saint-Michel Normandy Brittany Private Trip from Paris,"Paris, France"
Paris by Night: Private Walking Tour including Seine River Cruise,"Paris, France"
8-hours VIP Private Sightseeing and Shopping Tour in Paris,"Paris, France"
Make your tour in France an exceptional experience!,"Paris, France"
Paris Like a Local: Customized Private Tour,"Paris, France"
Louvre Museum: Explore the Egyptian Collection Private Tour,"Paris, France"
Private tour of the Monet House in Giverny from Paris or Rouen,"Paris, France"
Insider Louvre: from a Royal Palace to a museum,"Paris, France"
"Private City-Tour by pedicab in Paris : The ""Napoléon""","Paris, France"
Eiffel Tower Guided Tour Summit Access,"Paris, France"
Paris Photography Tour with a Local Expert: Private & Personalized,"Paris, France"
"Paris 3 Day Tour To Eiffel Tower, Louvre, Seine Cruise,Versailles","Paris, France"
Half-Day Chauffeur Service Sedan In Paris,"Paris, France"
Vacation Photographer in Paris,"Paris, France"
Napoleon III's Paris city tour,"Paris, France"
Transfert Privé Aéroport Charles de Gaulle vers Paris,"Paris, France"
Versailles in a Day: The Ultimate Sidecar Expedition,"Paris, France"
Private Transfer: Paris City to Paris Airport CDG in Luxury Van,"Paris, France"
Explore the collection at the Pompidou,"Paris, France"
Private excursion to Chartres Cathedral,"Paris, France"
Eiffel Tower with private pick up from your hotel,"Paris, France"
"2 Hours Photoshoot tours at the Eiffel tower, Trocadero, Champ de Mars and more","Paris, France"
Private Guided Photoshoot at the Eiffel Tower in Paris,"Paris, France"
Wonders of Paris by bike (night ),"Paris, France"
Private 3-hour tour in Louvre Museum with official tour guide,"Paris, France"
Full Day Private Guided Tour of Paris and Versailles,"Paris, France"
"America's Founding Fathers in Paris, Walk in their Footsteps (Small Group Tour)","Paris, France"
Charles de Gaulle airport transfer to Paris hotel,"Paris, France"
Paris: Montmartre & Sacré Coeur Private Walking Tour,"Paris, France"
Orsay Private Tour with your own Art Historian Guide,"Paris, France"
Private Transfer From Paris to Bayeux,"Paris, France"
A Private Visit to the Louvre Museum,"Paris, France"
Emily in Paris Small Group Tour,"Paris, France"
Private transfer from Charles de Gaulle or Orly Airport to Disneyland,"Paris, France"
2-hour Private Night Ride in a Citroën 2CV in Paris,"Paris, France"
Private Paris City Night Sightseeing Tour - Sparkle Eiffel Tower,"Paris, France"
Palace Of Chantilly - Private Trip,"Paris, France"
"Domaine de Chantilly in a Mercedes VAN (7pax max), Chateau Museum...","Paris, France"
Paris: Your Own Private Photoshoot at Montmartre,"Paris, France"
Liberty scooter rental Piaggio 50cc (4T) Paris,"Paris, France"
Paris Shopping Spree & Walking Tour with a Local Guide,"Paris, France"
Scooter rental X-ADV Honda 2023 (A2 license) Paris,"Paris, France"
Loire Valley Castles Private Day Trip from Paris,"Paris, France"
Paris Lights Evening Bus Tour with Eiffel Tower Summit Option,"Paris, France"
"Artists in Montparnasse, smartphone audioguided tour","Paris, France"
Private Return Transfer Thoiry Zoo Safari from Paris,"Paris, France"
Private Driver Airport Paris,"Paris, France"
"Private Chenonceau, Chambord Minivan Trip from Paris Wine tasting","Paris, France"
Provins - Medieval City - Private Trip,"Paris, France"
Heart of Bohemia Tour / duration 2H - from 1 to 6 passengers,"Paris, France"
Paris Louvre Museum Private Guided Tour with Pre-Reserved Tickets,"Paris, France"
Paris 3-Hour Bike Tour and Market Food Tasting,"Paris, France"
Versailles Private Half-Day Guided Tour from Paris,"Paris, France"
Bundle of Père Lachaise Cemetery: Self-Guided Audio Tours,"Paris, France"
"Chambord, Chenonceau, Da Vinci Castle Small group Trip from Paris","Paris, France"
Discover Paris in electric golf carts,"Paris, France"
Architectural Bourgeois Paris 19th Century,"Paris, France"
Private Full Day Paris trip including Louvre and Versailles with Pickup,"Paris, France"
Private Tour: Palace of Versailles Half-Day Tour from Paris,"Paris, France"
Normandy D-Day Landing Beaches Guided Tour from Paris,"Paris, France"
Hidden water & secret villages: A self-guided audio tour around Parc Montsouris,"Paris, France"
Paris Marché d’Aligre Walking Tour with Chocolate and Cheese Tasting,"Paris, France"
Champagne Private Wine Tastings Day Trip with Veuve Clicquot,"Paris, France"
Explore Paris’ best Street Art Quarters with a Local,"Paris, France"
Paris City Departure Private Transfer to Paris Airport CDG in Business Car,"Paris, France"
Monet & Rodin Skip the line Private Tour with a Local Expert Guide,"Paris, France"
Private Louvre Tour in Paris for Kids and Families,"Paris, France"
Private Walking Tour of Montmartre and Sacré-Cœur Basilica,"Paris, France"
Small Group Guided Tour Champagne by Van Meet a Local Producer,"Paris, France"
Private Transfer: Paris Airport CDG to Paris City by Luxury Van,"Paris, France"
Paris Private Tour with Hotel Pick Up,"Paris, France"
Skip-the-line Musée de l'Orangerie and d'Orsay with Guide,"Paris, France"
Private Transport from Charles de Gaulle Airport to Paris,"Paris, France"
Paris City Of Lights Photoexploring Tour,"Paris, France"
Fontainebleau & Vaux-le-Vicomte Trip with Local Guide & Private Transportation,"Paris, France"
Paris Family Custom Tour: Kids-Friendly Day with Private Guide,"Paris, France"
La Vallée Village - Parisian Relaxation Shopping Spot - Private Tour,"Paris, France"
Private Transport from Paris to Mont-Saint-Michel via Saint Malo,"Paris, France"
Your best pictures in Paris 1h Private photoshoot,"Paris, France"
Photoshoot in Paris Centre for solo travellers,"Paris, France"
Private Transfer from Paris City to Disneyland Paris by Luxury Van,"Paris, France"
"Half Day Trip: Paris to Castle of Chantilly, Museums and Park","Paris, France"
Private Transfer from Gare de Lyon Station to Paris City or hotel,"Paris, France"
Père Lachaise Cemetery: A Stroll Through Immortal History,"Paris, France"
"Preserved Flower Crown Workshop In Paris, France","Paris, France"
Bentley Chauffeur Service in Paris,"Paris, France"
Pere Lachaise Cemetery Private Walking Tour,"Paris, France"
Private Paris city tour with Minivan,"Paris, France"
Versailles Palace & Giverny Private Guided Tour with Lunch and Priority Access,"Paris, France"
Beauvais airport shuttle to Paris round trip,"Paris, France"
Scavenger Hunt in the Covered Passages of Paris,"Paris, France"
Private Transfer from Paris Train Stations to Hotels,"Paris, France"
1 Day Paris City Tour on River & Land with Louvre Museum ticket,"Paris, France"
Day trip to Mont-Saint-Michel from Paris,"Paris, France"
Authentic Indian Dinner in Paris,"Paris, France"
Private transfer 1 day round trip to Disney,"Paris, France"
3-day Private Omaha Utah Full D-Day Mont Saint-Michel from Paris,"Paris, France"
South Pigalle Food Tour Small Group: The Cool Apéro Tour in Paris,"Paris, France"
Marais District 2-Hour Private Walking Tour in Paris,"Paris, France"
Chantilly Estate Full Day Private Guided Tour from Paris,"Paris, France"
Eiffel Tower Express Private Photo Session,"Paris, France"
3 Hour Wedding Bouquet Private Workshop in Paris,"Paris, France"
"2-Days Private Guided Tour in Normandy: D-day, MSM, Rouen etc","Paris, France"
Create unique jewelry from top Parisian designer Bijoux Blues,"Paris, France"
Street Art tour of the most beautiful frescoes in Paris!,"Paris, France"
Historic Paris: Exclusive Private Tour with a Local Expert,"Paris, France"
French Revolution Truth and Myths - Private Walking tour,"Paris, France"
Escape game Forge,"Paris, France"
Private Paris City Tour with Minivan,"Paris, France"
Architectural Paris: Private Tour with a Local Expert,"Paris, France"
Private Christmas Market & Chocolate Tour in Paris,"Paris, France"
Musee de l'Armée and Seine River Cruise Ticket,"Paris, France"
Louvre museum,"Paris, France"
Parisian Picnic Escape: Cheese & Wine Tasting,"Paris, France"
No Fat No Fun - A Pastry Chef's Sweet Secrets of Paris,"Paris, France"
Private car with a driver in Paris 4-6 persons,"Paris, France"
Full-Day Chauffeur Service Sedan In Paris,"Paris, France"
Emily in Paris Outdoor Escape Game: The Secret Penpal,"Paris, France"
Private Tour from Paris to Versailles by Electric Bike,"Paris, France"
Private Walking Tour with Fashion Photographer and Paris Guide,"Paris, France"
Private Van Tour in Paris 8-Hours,"Paris, France"
The Most Authentic & Deep Paris Tour - Highlights & Trendy Neighborhoods,"Paris, France"
"Private Guided Tour In Normandy - Rouen, Honfleur, Etretat (ex)","Paris, France"
The Beauty of Paris by Bike: Private Tour,"Paris, France"
Greek Mythology at the Louvre. Private tour.,"Paris, France"
Palace of Versailles 8-hour Tour From Paris,"Paris, France"
Sir John Monash Centre in the Somme from Paris aboard a Van (4/7 pax),"Paris, France"
The History of Impressionism: Paris Musée d’Orsay Private Tour,"Paris, France"
Niche Perfume 4-Hour Private Consultation and Tour in Paris,"Paris, France"
Private transfer: Charles de Gaulle Airport (CDG) to Paris VAN up to 8 PAX,"Paris, France"
Paris to Paris Charles de Gaulle Airport (CDG) - Departure Private Transfer,"Paris, France"
Etretat - Garden Of Etretat & Cliffs - Private Trip,"Paris, France"
Literary Latin Quarter,"Paris, France"
Paris in a Day VIP and Private Tour with Pick-Up and Drop-Off,"Paris, France"
Private Professional PHOTOSHOOT in Paris,"Paris, France"
Normandy E-Bike Guided Tour from Paris - DDay Omaha,"Paris, France"
Private Transfer FROM Paris To Disney,"Paris, France"
Treasure Hunt to the Auction Rooms in Drouot,"Paris, France"
Paris Professional Photoshoot at the Arc de Triomphe,"Paris, France"
Paris Walking Tour!,"Paris, France"
Travel Planner for your perfect trip to Paris,"Paris, France"
Private 12-hour Tour to Bruges from Paris with driver & guide with hotel pick up,"Paris, France"
Transfer Paris to airport CDG and ORLY 8 pax,"Paris, France"
Private Van Tour from Paris to the Palace of Versailles and Giverny,"Paris, France"
"Private Round Trip: Paris City, ORY or CDG Airport to Paris Disneyland by Van","Paris, France"
Private Urban Photo Shooting Session in Paris,"Paris, France"
Photoshoot with a Pro Photographer in Paris,"Paris, France"
Private Transfer from Beauvais Airport to Paris,"Paris, France"
Self-guided Mystery Walk by the Notre Dame,"Paris, France"
Private full-day Champagne Cellars tour from your hotel in Paris,"Paris, France"
Paris Wine and Food tour: Foodie's Paradise,"Paris, France"
Secrets of the Parisian Passageways: A Unique Walking Tour,"Paris, France"
All Inclusive Paris: Full-Day Walking tour with the Eiffel Tower,"Paris, France"
An Evening of French Wine & Cheese - 2 Hour tasting experience,"Paris, France"
Guided Adventure in Paris by Electric Scooter,"Paris, France"
Montmartre Private Walking Tour,"Paris, France"
Lupin's Footsteps: A Self-Guided Walking Tour in Paris,"Paris, France"
BURGUNDY: VEZELAY & FONTENAY ABBEY - Private day trip from Paris by Train,"Paris, France"
Private Photo Shoot in Paris,"Paris, France"
Private Mont Saint-Michel trip from Paris Calvados tasting,"Paris, France"
Your Friendly Paris Photographer,"Paris, France"
"Paris First Time Private Tour with Notre Dame, Montmartre & Arc de Triomphe","Paris, France"
"Pointe du Hoc, Omaha beach from Paris aboard a van (Private Tour)","Paris, France"
Montmartre Guided Tour with Sacré Cœur Church and City views,"Paris, France"
Transfer from CDG/ORLY/LBG Airport to Paris by Van (8PAX),"Paris, France"
Private Van Transfer from CDG To Airport Beauvais,"Paris, France"
Fontainebleau private excursion,"Paris, France"
Private Giverny Half-day Trip from Paris by Mercedes Lunch option,"Paris, France"
Full-Day Private Guided Tour of Champagne wih Hotel Pickup,"Paris, France"
Eiffel Tower and Seine River Cruise with Private pick up and drop from Hotel,"Paris, France"
Arrival Private Transfer from Paris Orly Airport ORY to Paris City by Luxury Van,"Paris, France"
Normandy Small Group Trip with Lunch plus Liqueur & Calvados Tastings from Paris,"Paris, France"
Père Lachaise's Cemetery Celebrities and Ghosts Mystery Tour,"Paris, France"
2 Hour Market Tour in Marche d'Aligre with a Food Writer,"Paris, France"
Learn French naturally with our Normandy & Paris Impressionist tour for adults.,"Paris, France"
Discover Paris’ most Photogenic Spots with a Local,"Paris, France"
Paris Illumination Tour & Eiffel Tower (reseved access),"Paris, France"
5 Hour Private Louvre Audio Tour with Cruise and Transfer,"Paris, France"
Audio guided Louvre museum Tour with hotel pick up,"Paris, France"
CDG pick up with Montmartre and la Vallée Village Tour,"Paris, France"
Parisian Gems: Independent Exploration from Your Cruise Ship,"Paris, France"
Spectacular Paris Self-Guided Audio Tour,"Paris, France"
Louvre Area Photo Shoot - Paris Photographer,"Paris, France"
Half Day Shopping Tour with Pick up from any Paris Airport,"Paris, France"
Private 4-hour Walking Tour of Latin Quarter & Notre Dame in Paris,"Paris, France"
Unexpected bars - solo meet up edition,"Paris, France"
Epic Tales of the Medieval Paris Private Walking Tour,"Paris, France"
A Private Visit to the Musée d'Orsay,"Paris, France"
Half Day Tour Throughout Paris in Vintage Car & Crazy Horse,"Paris, France"
Discover Paris while escaping the zombies! Escape room,"Paris, France"
Louvre Museum: Family-Friendly Private Guided Tour,"Paris, France"
Half Day Tour with Pick up from Charles De Gaulle Airport,"Paris, France"
6-Hour Paris private tour with a professional photographer,"Paris, France"
Half Day Paris Tour with Pick up from Orly airport,"Paris, France"
Paris Guided Walking Tour,"Paris, France"
Private Fontainebleau with Minivan,"Paris, France"
Romantic VIP Photoshoot in Paris with Champagne & Private Transfers,"Paris, France"
Private Transfer From Paris City Center to Orly Airport (ORY),"Paris, France"
Paris & Giverny in One Day with Lunch and Roundtrip VIP Transportation,"Paris, France"
Half-Day Private Versailles Trip and Seine River Cruise,"Paris, France"
Paris 3-hour walking tour,"Paris, France"
Private Round Trip transfer: ORY or CDG Airport to Paris Disneyland by car,"Paris, France"
Giverny & Rouen Private Tour from Paris,"Paris, France"
6 Hours Wine Tasting and Shopping Tour in France,"Paris, France"
"Luxury and private transfer (Mercedes E), Paris from/to airports","Paris, France"
Skip the line Arc de Triomphe Private Tour with Transfers,"Paris, France"
"7-day Private Burgundy Wine tastings, Provence, Nice, Monaco Tour","Paris, France"
Beauvais Airport (BVA) to Paris City Private Transfer,"Paris, France"
"Food Tour around Eiffel with Louvre, Wine & Hotel Pick Up","Paris, France"
"Bike Tour of Paris Old Town, Top Attractions and Nature","Paris, France"
Walking Tour : History of Paris,"Paris, France"
"3-Day Private Normandy — Brittany — 3 Loire Castles, Oysters & Calvados tasting","Paris, France"
Grevin Wax Museum in Paris and Seine River Cruise Tickets,"Paris, France"
Private Transfer from Dinan to Paris - Up to 7 People,"Paris, France"
Eiffel Summit and Walking Tour in Saint Germain des Prés,"Paris, France"
Full-Day Private Champagne Tasting in Reims and its Vineyards,"Paris, France"
Private transfer to Le Mans from Paris or back,"Paris, France"
E-Bike City Tour in Paris,"Paris, France"
2 hours Paris Private Vintage Car Tour with hotel Pick up and Drop,"Paris, France"
Private transfers from CDG or ORLY airports Travel to Paris,"Paris, France"
7 Hours Paris Private Sightseeing Tour with Wine Tasting,"Paris, France"
"Private Vintage Car Tour with ""Montmartre"" area in Paris and Pick up drop","Paris, France"
"Versailles, Eiffel,Summit Cruise & Wine Tasting with CDG Transfer","Paris, France"
"7-Day Trip to France, Switzerland, Italy and Monaco","Paris, France"
Private transport: CDG & Orly Airports / Disneyland Paris,"Paris, France"
Sensual Boudoir Shoot With Fashion Photographer,"Paris, France"
7-day Small-group Burgundy Wine tasting Provence Nice Monaco Tour,"Paris, France"
Private Transfer between Paris - La Vallee Village by Sedan Car,"Paris, France"
Eiffel Tower Half-Day Private Tour with Seine River Dinner Cruise Hotel Pick up,"Paris, France"
Paris to Bordeaux Private Transfer,"Paris, France"
Giverny and Honfleur Private Day Trip from Paris,"Paris, France"
Outdoor walking tour for Kids & Families w/ Paris Catacombs fast access tickets,"Paris, France"
Christmas Fairytale: Vaux-le-Vicomte Chateau Private Guided tour,"Paris, France"
Private Bruges 10 Tastings Tour from Paris by Minivan,"Paris, France"
Half-Day Tour with Crepe and Eiffel Summit Visit with Pick up,"Paris, France"
Rolls-Royce 2 hours Paris illumination Tour,"Paris, France"
Private Transfer From Paris to Normandy with stop in Giverny,"Paris, France"
Private Home Dining Experience in the Heart of Paris,"Paris, France"
Paris Je T'aime: Private Half-Day Highlights Walking Tour,"Paris, France"
Private Tour with Skip the Line Tickets to Louvre Museum & Crepes,"Paris, France"
Private round transfer from Paris hotel to PSG Stadium,"Paris, France"
Paris Pantheon & Basilique de Saint-Denis Multi-pass,"Paris, France"
Paris Full day 10 hours Tour with Seine River Cruise and Crazy Horse Cabaret,"Paris, France"
12 Days Historical Tour in Paris,"Paris, France"
Paris CDG: from/to Charles de Gaulle airport,"Paris, France"
Unforgettable Loire Valley VIP tour (from Paris) - Tree castles in one day!,"Paris, France"
Paris VIP Open Bus Tour with Cruise Eiffel Tower and Pick up,"Paris, France"
Montmartre Self Guided App Tour,"Paris, France"
Vintage Shopping Tour in Paris with a Guide,"Paris, France"
Private Half-Day Napoleon at the Louvre Tour,"Paris, France"
Private Shopping with a fashion expert - Emerging Designers & Concept Stores,"Paris, France"
Eiffel and Private Night Tour with CDG Airport pickup,"Paris, France"
Jazz Concert in St Germain dès Près,"Paris, France"
Louvre to Seine River Cruise Private Tour with Airport Pick up,"Paris, France"
LOIRE VALLEY: CHAMBORD CASTLE EXPRESS by train (avoid traffic jams),"Paris, France"
Paris Hotel to Gare Montparnasse Railway Station Private Transfer,"Paris, France"
Paris Private Walking Tours with a Local Guide: 100% Personalized,"Paris, France"
Private Departure Transfer from Paris City centre to Paris Beauvais Tillé airport,"Paris, France"
Private Autumn Park Photoshoot to Paris,"Paris, France"
Full Day Private Shore Tour in Paris from Le Havre Cruise Port,"Paris, France"
Private Normandy Tour DDAY Beaches from Paris,"Paris, France"
Versailles Palace Skip-the-Line Private & Customized Half Day Tour from Paris,"Paris, France"
