Attraction,City
2 Hour Walk in Montmartre,"Paris, France"
Private Parisian Photo Shoot in Montmartre,"Paris, France"
DDay Beaches small group tour in Normandy from Paris,"Paris, France"
Paris Gems & Charms Tour for Cruise Passengers from Le Havre,"Paris, France"
"Paris on Your Own : Scenic, Savory & Stylish Day from Le Havre","Paris, France"
Paris Catacombs Hosted With Access Tickets,"Paris, France"
Kid-friendly Paris City Center Tour and Catacombs Entry Tickets,"Paris, France"
Eiffel Tower and Seine River Cruise Self- Guided Audio Tour,"Paris, France"
Paris Hop-On Hop-Off Bus Full Day Tour,"Paris, France"
Seine River Cruise flexible ticket with Audio in Paris - 1 Hour,"Paris, France"
Lupin Filming Locations on Private Paris Tour with Local Guide,"Paris, France"
Paris: Orsay Museum Timed-Entrance Ticket with Digital Audio,"Paris, France"
Secret Covered Passages Tour in Paris,"Paris, France"
3-Hour Private Electric Tuktuk Tour in Paris,"Paris, France"
From Paris: Château de Fontainebleau and Vaux-le-Vicomte,"Paris, France"
Chapel of Our Lady of the Miraculous Medal Paris Guided Tour,"Paris, France"
VIP Dinner on the Eiffel Tower Paris,"Paris, France"
Paris Picasso Museum Entrance And Audio Guided,"Paris, France"
Marais Tour With a Local,"Paris, France"
Louvre Museum & Musée d'Orsay - Exclusive Guided Tour (Reserved Entry Included!),"Paris, France"
Street Art tour in Paris - Discover Paris murals !,"Paris, France"
Paris Ile-de-la-Cité Walking Tour: Max 6 People Group or Private,"Paris, France"
Paris Night Segway tour,"Paris, France"
Private 3 Loire Valley Castles from Paris Mercedes Wine tasting,"Paris, France"
Giverny - Claude Monet's House & Gardens - Private Trip,"Paris, France"
BEST OF PARIS : 3 smartphone audioguided tours,"Paris, France"
Chablis 20 Exquisite Wines Tasting Trip in Small-Group from Paris,"Paris, France"
Paris Tour with Lunch at the Eiffel Tower and Seine River Cruise,"Paris, France"
Transfer from Paris Charles de Gaulle Airport to Paris,"Paris, France"
Louvre Murder and Mystery Tour,"Paris, France"
Packaged Cruise on Canal St Martin & Seine River,"Paris, France"
Private Burgundy 3 Domaines Chateau Pommard Chablis 15 Wines Trip,"Paris, France"
Private Seine Cruise,"Paris, France"
Private tour of various Monuments in Paris,"Paris, France"
Arrival Transfer from Paris Airport CDG to Paris in Private Van,"Paris, France"
LOIRE VALLEY: Your selection of three castles to visit (Day-trip from PARIS),"Paris, France"
Giverny Auvers Van Gogh Private Guided Day Tour from Paris,"Paris, France"
Le Marais Food Tour with a Local Guide: Private & Personalized,"Paris, France"
Private Covered Passages & Palais Royal Gardens 2-Hour Tour,"Paris, France"
All about meringue: a pastry & culinary arts workshop in Paris,"Paris, France"
Night Group Tour on Segway,"Paris, France"
Paris Highlights Sidecar Tour,"Paris, France"
Meeting with the artist Franck SADOCK in Paris 09 (9th arrondissement),"Paris, France"
Paris Eiffel Tower Vows Renewal Ceremony - Photoshoot and Video,"Paris, France"
Full-day Private Tour in Mont Saint Michel with Calvados Tasting,"Paris, France"
Guided tour of Paris in Citroën Traction Avant or DS 21,"Paris, France"
Mont Saint-Michel EXPRESS (day-trip from Paris by TGV - high speed train),"Paris, France"
Private Street Art Tour in Paris with Local Expert,"Paris, France"
Seine Dinner Cruise and Eiffel Tower Summit Private Tour,"Paris, France"
Pre-booked Timed Eiffel Tower Ticket to 2nd floor by Elevator,"Paris, France"
The Unmissable of Paris on a Classic Citroën DS with Open Roof,"Paris, France"
Shuttle Arrival Transfer from Paris Airport to Hotel/ Apartment,"Paris, France"
Private cruise with Paris water way,"Paris, France"
VAUX-LE-VICOMTE- private day-trip (pickup and dropoff at/to your hotel in Paris),"Paris, France"
Euro Disney - PARIS (One Way) Private Shuttle Transfer,"Paris, France"
"""The Old Paris"" on the Canal Saint Martin : Port de l'Arsenal","Paris, France"
Walk & Wine Tour in the Latin Quarter,"Paris, France"
Guided tour of Bruges with canal cruise option (Hotel Pick),"Paris, France"
Saint Germain des Prés Food Tour,"Paris, France"
Paris Crazy Horse Meet a Dancer before the Show Experience,"Paris, France"
Classic French Cooking Class in Paris with a Local Expert,"Paris, France"
Life at the Marais during World War II,"Paris, France"
Departure Private Transfer from Paris City to Paris Train Stations by car or van,"Paris, France"
Private Preserved Flower Bouquet Arrangement Workshop in Paris,"Paris, France"
VERSAILLES CASTLE Round-Trip Transfer from Paris by Luxury Van,"Paris, France"
Vintage Shopping Tour In Paris with a Guide,"Paris, France"
Private 5-hour tour to Palace of Versailles (skip the line) from Paris Hotel,"Paris, France"
Medieval Paris including Sainte Chapelle and Conciergerie,"Paris, France"
The Super Fun Family Tour,"Paris, France"
3 days in Paris with a Private Guide,"Paris, France"
Latin Quarter Walking Tour: Uncover the Secrets of Paris,"Paris, France"
Private One way Transfer Paris Orly Airport (ORY),"Paris, France"
"Self-Guided Tour - Père Lachaise Cemetery Audioguide, Paris","Paris, France"
The Da Vinci Code in Paris: Follow the Trail with a Local,"Paris, France"
Who Stole the Mona Lisa? Scavenger Hunt in the Louvre Museum,"Paris, France"
The Rodin Museum and Seine River Cruise Tickets,"Paris, France"
Versailles Palace Audio-Guided Tour by Shuttle from Paris,"Paris, France"
Paris Scavenger Hunt and Best Landmarks Self-Guided Tour,"Paris, France"
Self-Guided Audio Tour - Montmartre: The heart of art and bohemia,"Paris, France"
Paris Self-Guided Audio Tour,"Paris, France"
Secret Paris Tour on a dutch bike,"Paris, France"
Private round trip transfer from/to Paris airports,"Paris, France"
Fontainebleau and Vaux Le Vicomte Private Day Tour from Paris,"Paris, France"
Paris Highlights & Lafayette Shopping from Le Havre,"Paris, France"
Private Auto Paris City Tour with Audio Guide,"Paris, France"
"Private 5-hour Round Transfer to Giverny, Claude Monet museum from Paris","Paris, France"
Private day tour to Giverny Gardens and Rouen from Paris,"Paris, France"
From Paris Full Day Trip To The Normandy D-Day Beaches With Lunch,"Paris, France"
Explore Paris in 3 Hours: Authentic 2CV Tour Experience,"Paris, France"
Eiffel Tower Climbing Tour,"Paris, France"
Eiffel Tower Elevator Visit with a Guide and City Bus Tour,"Paris, France"
Private One way Transfer Paris Charles de Gaulle Airport,"Paris, France"
Eiffel Tower Skip the Queue Ticket by lift and Audio Guide Tour,"Paris, France"
Classical Perfume Workshop in Paris VI,"Paris, France"
BURGUNDY : Unique Wine Tour from PARIS (Day-trip by TGV - High-speed train),"Paris, France"
Paris Olympic Venue Highlight: Car Tour,"Paris, France"
Classical Perfume Workshop in Paris Ier,"Paris, France"
Paris by night in a Private tuk-tuk Tour,"Paris, France"
Louvre Museum Priority Access Ticket & Digital Audio guide,"Paris, France"
Versailles Palace Private Tour from Paris/skip-the-line ticket,"Paris, France"
Audio guided tour and wine tasting at Caves du Louvre,"Paris, France"
Solo in Paris Meetup in a Bar,"Paris, France"
Versailles Private Half Day Guided Tour with Skip the Line Access from Paris,"Paris, France"
Private transport from Paris to Charles de Gaulle airport,"Paris, France"
"Opera,Jewelry Fashion, Palais Royal Garden Walking Tour in Paris","Paris, France"
Pierrefonds & Compiègne Palaces -2 Castles Private Trip,"Paris, France"
"Paris Day Tour with Eiffel Tower, Louvre and Cruise","Paris, France"
Exclusive Musée d'Orsay Tour & Giverny Day Trip from Paris,"Paris, France"
Louvre masterpieces in 2 hours,"Paris, France"
Paris City Tour by Seine River Cruise- Bateaux Parisiens,"Paris, France"
Private Guided Day Tour of Mont St-Michel from Paris,"Paris, France"
Beyond the Louvre Museum - Self-Guided Audio Walking Tour,"Paris, France"
Notre Dame Exterior Ile de la Cité Tour and Sainte Chapelle,"Paris, France"
Private tour of Père Lachaise cemetery,"Paris, France"
Giverny and Saint Germain des Prés with Private Transportation,"Paris, France"
Private Tour in Eiffel Tower with Guide and Pick up,"Paris, France"
3-day Private Loire Castles Trip with 2 Wine tastings from Paris,"Paris, France"
Seine River Double Cruise by Day and by Night,"Paris, France"
Brussels and Bruges Guided Tour from Paris,"Paris, France"
Panthéon Paris Entrance Tickets,"Paris, France"
Paris: Louvre and Royal Gardens Private Photowalk,"Paris, France"
Private Normandy Live guided trip to Rouen — Honfleur — Deauville,"Paris, France"
Go City | Paris Explorer Pass - Choose 3 to 7 Attractions,"Paris, France"
Arc de Triomphe Self-Guided Ticket & Big Bus Hop-On Hop-Off,"Paris, France"
Paris Bus Sightseeing Tour from Disneyland Paris,"Paris, France"
"Paris Louvre, Seine River Cruise And Hop on Hop Off Bus Tour","Paris, France"
Louvre Museum Entrance Reserved Access Tour,"Paris, France"
Pompidou All exhibitions + Collection,"Paris, France"
Paris Montmartre Private Walking Food Tour With Secret Food Tours,"Paris, France"
Paris Highlights: Half Day Private Walking Tour,"Paris, France"
Great Women of History walking tour,"Paris, France"
Parcours Bois de Vincennes - Segway Tour of Paris,"Paris, France"
Paris - Historic City Center Walking Tour,"Paris, France"
Paris Père Lachaise Cemetery Love Affairs and Death Walking Tour,"Paris, France"
Segway Eiffel Tour Paris,"Paris, France"
Historical Paris Walking Tour to Vibrant Food Market,"Paris, France"
Paris Renew Your Wedding Vows Experience with Professional Photographer,"Paris, France"
Musée d'Orsay & Montmartre - Semi-Private 8ppl Max (Reserved Entry Included!),"Paris, France"
"Design Your Personalized Luxury Jewelry in Le Marais, in the heart of Paris!","Paris, France"
Virtual Room Paris - 1st virtual reality team experience,"Paris, France"
Exclusive Champagne tour from Paris including 3 house visits,"Paris, France"
Private tour Paris 3 hours in Citroën 2CV,"Paris, France"
Orsay Museum Private Guided Visit,"Paris, France"
Montmartre & Sacré Coeur Private Historical 2-Hour Walking Tour in Paris,"Paris, France"
PARIS PHOTO - Joyful stroll for a Private Professional Shoot,"Paris, France"
Private tour Paris Little-known places 2 hours in Citroën 2CV,"Paris, France"
Paris Walking Tours: Discover Paris' Iconic Sites and Secret Spots,"Paris, France"
"Private Day trip to Rouen, Normandy: On the footstep to Joan of Arc","Paris, France"
Latin Quarter Private Walking Tour,"Paris, France"
Skip-The-Line Centre Pompidou Paris Guided Museum Tour - Semi-Private 8ppl Max,"Paris, France"
Pompidou Museum Paris 2-Hour Private Guided Tour,"Paris, France"
Best of the Louvre Museum Private Tour with Monalisa,"Paris, France"
Shuttle Inter,"Paris, France"
Paris 3-hour Sightseeing Bike Tour,"Paris, France"
Private Pilotage of a Flight Simulator in Paris,"Paris, France"
Orsay Museum Guided Tour (Exclusive Entry),"Paris, France"
2H Discovery Tour of Paris in 2CV CITROEN,"Paris, France"
"Paris Street Art, smartphone audioguided tour","Paris, France"
Louvre Museum Guided Tour (Reserved entry Included),"Paris, France"
WW1 Belleau Wood and American Monument in Château-Thierry - Day trip from Paris,"Paris, France"
3H Grand Paris Tour in 2CV CITROEN,"Paris, France"
Rodin Museum Paris 2-Hour Private Guided Tour,"Paris, France"
WWI Belleau Wood & Meaux Museum of the Great War Private Day Trip from Paris,"Paris, France"
Louvre Private Tour with your own Art Historian Guide,"Paris, France"
Paris Half Day Semi Private Tour with Private Options,"Paris, France"
Montmartre Small Group Walking Tour in Paris,"Paris, France"
"See 30+ Top Sights Paris Tour, Fun Guide + Wine Tasting Experience","Paris, France"
"Day Trip to Fontainebleau : Horse Riding, Gastronomy and Castle","Paris, France"
Paris Airport Transfer Service,"Paris, France"
Discover Highlights of Impressionism and Hidden Gems in Musée d'Orsay,"Paris, France"
Paris 6 Grand Cru Wine Tastings with a Professional Sommelier Guide,"Paris, France"
Versailles Private Excursion,"Paris, France"
Paris Top Attractions & Hidden Gems around your Hotel Private Orientation Tour,"Paris, France"
The Impressionists at Orsay - skip the line,"Paris, France"
Full Day Private Tour of Historical Normandy American Sites from Paris,"Paris, France"
Louvre Skip the Line Private Tour,"Paris, France"
Giverny Half-Day Guided Tour from Paris,"Paris, France"
Paris Private Full Day Tour – Skip the Line Tickets to Louvre & French Lunch,"Paris, France"
Versailles Palace Family Tour with Private Transfers and Lunch,"Paris, France"
Paris French Wine Tasting 3-Course Dinner,"Paris, France"
Versailles Domain Private Half Day Guided Tour with Hotel Pickup from Paris,"Paris, France"
Paris Gay Marais Semi-Private Walking Tour,"Paris, France"
Bruges tour from Paris: Guided private trip & Chocolate Tasting,"Paris, France"
Treasure hunt along the Seine to visit Paris!,"Paris, France"
Paris 2-Hour Small Group Tour of Pere Lachaise Cemetery,"Paris, France"
Small Group Tour - Paris Sweet Tooth Stroll,"Paris, France"
Picasso Museum Paris 2-Hour Private Guided Tour,"Paris, France"
Private Tour: Personal Travel Photographer Tour in Paris,"Paris, France"
Private Van Transfer from CDG Airport to Paris,"Paris, France"
Private Transfer Orly Airport ORY & Disneyland Paris,"Paris, France"
Champagne Private VIP Wine Day Trip with Michelin Lunch,"Paris, France"
Montmartre Private Walking Tour,"Paris, France"
Paris City Tour,"Paris, France"
Private Bastille and Aligre market walking tour with the highline,"Paris, France"
Scooter rental TMAX Yamaha 560cc 2023 (A2 license) Paris,"Paris, France"
Les Invalides: Napoleon & French Military History Semi-Private Tour,"Paris, France"
Behind the Scenes of a Boulangerie: French Bakery Tour in Paris,"Paris, France"
French Gourmet Cuisine: Dinner and Wine Pairing,"Paris, France"
Private Champagne Day Trip to Vineyards of Reims with French Lunch from Paris,"Paris, France"
Normandy D-Day Landing Beaches with Private Guide From Paris,"Paris, France"
From Paris:Small Group Champagne Day Trip with 7 Tastings & Lunch,"Paris, France"
Semi-Private Homoerotic Louvre Tour with Reserved Entrance Time,"Paris, France"
The Louvre: art and love.,"Paris, France"
Versailles & Louvre Museum: All-Inclusive Semi Private Tour,"Paris, France"
Market to Market: A Culinary & Cultural Journey in Paris,"Paris, France"
Mont Saint Michel Tour From Paris,"Paris, France"
Private Photography Walking Tour of Paris: Latin Quarter or Montmartre,"Paris, France"
Private Vacation Photography Session with Local Photographer in Paris,"Paris, France"
"St Chapel, ile de la cité, Louvre, - priority access - Private tour- ENG/ESP","Paris, France"
Private 10-hour Shore Excursion to Paris from Le Havre (official guide in Paris),"Paris, France"
Canadians in Normandy D-Day beaches Juno Beach and Pegasus Bridge (3/7 pax),"Paris, France"
VIP Paris in a Day Tour with River Cruise Small Group or Private,"Paris, France"
Private Louvre Museum Guided Tour with Hotel-Pickup in Paris,"Paris, France"
6 Hour Shared Walking Tour in Paris with Local Guide,"Paris, France"
Paris Main Sights Bike Tour,"Paris, France"
Loire Valley 2 Days private tour all inclusive from Paris with train tickets,"Paris, France"
Private Transfer in Paris,"Paris, France"
Scandalous Paris-Belle Epoque Brothels & Courtesans,"Paris, France"
VAUX-VICOMTE: Candlelit evenings-every Saturday from may to sept,"Paris, France"
Le Marais Private Walking Tour,"Paris, France"
Louvre Private Skip-the-Line Tour by an Art Historian Guide with Hotel Pickup,"Paris, France"
Private transfer: Orly Airport to Paris,"Paris, France"
Château de Chantilly Tour from Paris Including the Great Stables of the Prince de Conde and a Renaissance-Style Meal,"Paris, France"
Private Paris Airport Layover Tour,"Paris, France"
Normandy Landing Beaches Private Day Tour from Paris,"Paris, France"
Sunset Versailles Bike Tour with Fireworks,"Paris, France"
"Giverny Private Trip with Monet's House, Gardens & Impressionism Museum","Paris, France"
Paris Engagement Proposal Private Walking Tour with Professional Photographer,"Paris, France"
"WW1 Australians in the Somme -Villers Bretonneux, Le Hamel - Day trip from Paris","Paris, France"
Custom private Paris food tour by walk from the Eiffel Tower,"Paris, France"
Paris Private Night Tour with River Cruise and Champagne Option,"Paris, France"
Wine tasting tour in Loire Valley with castle visits and lunch,"Paris, France"
Versailles & Giverny Private Day Tour Luxury van & Private Guide,"Paris, France"
Paris Private Tour from Le Havre Cruise Port/Hotels,"Paris, France"
visiting the masterpieces of impressionists at Orsay museum,"Paris, France"
Kickstart Paris Private Tour. City Highlights for Newcomers,"Paris, France"
Paris Photo Shoot for Families and Couples (30 minutes),"Paris, France"
Modern and Contemporary Art 2-hour Private Tour at Centre Pompidou in Paris,"Paris, France"
Montmartre Private Walking Tour,"Paris, France"
Kids Louvre Treasure Hunt - Private Tour,"Paris, France"
Eiffel Morning Hosted Visit,"Paris, France"
Charm and Secrets of Paris Passages,"Paris, France"
"Live, Laugh, Love along the Seine Outdoor Escape Game in Paris","Paris, France"
Skip the Line Half-Day Walking Tour of the Louvre's Mona Lisa,"Paris, France"
Paris Half Day Sightseeing Tour (no museum),"Paris, France"
Neoclassical Paris Architecture 2-Hour Private Walking Tour,"Paris, France"
Hunt for Treasures: Flea Market Tour in Paris,"Paris, France"
Welcome to Paris,"Paris, France"
2 Hours Walking Tour of Père Lachaise Cemetery from Paris,"Paris, France"
French Macaron Workshop with a Masterchef in his Private Atelier,"Paris, France"
Notre Dame quartier & Ile de la Cité Private 2-Hour Walking Tour in Paris,"Paris, France"
Paris Private Wine Tasting and Walk,"Paris, France"
Half Private Tour of Palace of Versailles with Train Tickets,"Paris, France"
Private transfer from Charles de Gaulle airport to Paris: Premium Service,"Paris, France"
Discover the Story of Coco Chanel with a Local in Paris,"Paris, France"
Mamma Mia! Paris Orsay Museum Guided Tour with Kid-Friendly Activity,"Paris, France"
PARIS - Euro Disney - PARIS Two Way Private Shuttle Transfer,"Paris, France"
"Mysteries & Legends, smartphone audioguided walking tour","Paris, France"
Teen Shopping and Fashion Accessories Tour in Paris,"Paris, France"
Dark Paris Myths & Legends Private Walking Tour,"Paris, France"
Louvre Essential Private tour,"Paris, France"
Paris (Montmartre) Scavenger Hunt and Sights Self-Guided Tour,"Paris, France"
WW1 Somme Battlefields - Private tour from Paris aboard a Van (2 pax),"Paris, France"
Private Transfer FROM Paris TO Roissy-Charles de Gaulle Airport,"Paris, France"
Crystal Workshop Learn to Create a Jewel,"Paris, France"
Airport Transfer: Paris Airport CDG to Paris City by Business Car,"Paris, France"
Private Photo Tour in Paris with a Professional Photographer,"Paris, France"
Private Graffiti Workshop,"Paris, France"
Iconic Portraits in an Exclusive Photoshoot at the Eiffel Tower,"Paris, France"
Half Day Paris Tour with Hotel pickup and drop,"Paris, France"
Discover the secrets of the Louvre,"Paris, France"
Private Airport Transfer between Paris and Parisian Airports,"Paris, France"
Private Mona Lisa First Access Louvre Tour,"Paris, France"
The Dark Side of Paris Walking Tour,"Paris, France"
Paris Overview tour with Driver,"Paris, France"
Private and authentic tour of the Latin Quarter (Paris),"Paris, France"
Versailles Castle Private Guided Day Tour from Paris (van &guide),"Paris, France"
Paris Opera House Family Tour,"Paris, France"
A Private Day in Paris,"Paris, France"
Two Days Private Tour to Normandy from Paris,"Paris, France"
Louvre Private Tour,"Paris, France"
Private Boat Tour in Paris with your own Captain/Guide,"Paris, France"
Soul of the City,"Paris, France"
D-Day Normandy Landing Beaches full day small group tour,"Paris, France"
Fat Cat gets the Early Bird: Montmartre,"Paris, France"
Pure Chocolate Tour in Paris,"Paris, France"
Chartres and Versailles Private Full-day tour,"Paris, France"
Highlights & Secrets of Paris Private Tour - Crêpes & Eiffel Tower,"Paris, France"
LOUVRE & ORSAY PRIVATE TOUR - Skip the line & Local Expert guide,"Paris, France"
Private Vintage Car Tour of Paris in a Citroën DS - 2H,"Paris, France"
Private Parisian Food Tour in Le Marais,"Paris, France"
Private Eiffel Tower district walking tour with Rodin Museum,"Paris, France"
Private Dark Chocolate Tasting Tour in Paris,"Paris, France"
Stories in the Heart of the City,"Paris, France"
Private 12-hour tour to Mt. Saint Michel from Paris Hotel with driver & guide,"Paris, France"
Louvre for Families,"Paris, France"
Paris Monuments Small Group Bike Tour,"Paris, France"
Private Guided Tour with Classic Cars in Paris,"Paris, France"
Marais semi private walking tour,"Paris, France"
Champagne Area Small-Group Tour including a Top Champagne house & Family Winery,"Paris, France"
Skip-the-line Les Invalides World War Museum Guided Tour - Exclusive Guided Tour,"Paris, France"
Half-Day Private Guided Walking Historic WW2 Tour of Paris,"Paris, France"
Paris Saint Germain Match at Parc des Princes,"Paris, France"
Private Fantastic Half-Day Tour in Paris,"Paris, France"
1 day in Paris with Friendly Local Guide,"Paris, France"
Paris city tour with private guide,"Paris, France"
Versailles Palace 4h Tour (Skip the Line Ticket & Licensed Guide),"Paris, France"
Private Market Tour and Classic French Cooking Class in Paris,"Paris, France"
"Private Rouen, Giverny Day trip from Paris with Michelin Lunch","Paris, France"
4 hours Paris Private Trip with one Indian Meal - Hotel pickup,"Paris, France"
Louvre Private Guided Visit-Skip The Line Access,"Paris, France"
Musée D'Orsay: the Impressionists and Beyond Small Group,"Paris, France"
"Paris, home for world musicians - Eng /Esp / Fr - 2h tour","Paris, France"
"BEST OF Artists in Paris, 3 smartphone audioguided tours","Paris, France"
2 Hour Private Guided 2CV Tour Experience in Paris,"Paris, France"
Private 12-hour round transfer to Belgium (Bruges) from Paris,"Paris, France"
Normandy D-Day Beaches Private Day Trip with American Cemetery & Omaha Beach,"Paris, France"
"Paris Tour: Eiffel Tower Lunch, Boat Cruise, and Louvre Tour","Paris, France"
Private Full Day Tour to Versailles and Giverny from Paris with Hotel Pick Up,"Paris, France"
"WW1 Somme Battlefield - Thiepval, Beaumont Hamel - Day trip from Paris (3/7 pax)","Paris, France"
Loire Valley Trip from Paris with Private Local Guide & Private Transportation,"Paris, France"
"Private Tour: Romantic Seine River Cruise, Dinner, and Illuminations Tour","Paris, France"
Wine Tasting in Paris right next to Père Lachaise & l'Atelier des lumières,"Paris, France"
Paris Photoshoot tour with private car,"Paris, France"
2-Hour Private Paris Champs-Élysées Walking Tour,"Paris, France"
Famous Sights of Paris- Private Tour with Pick-up and Drop-off,"Paris, France"
Private City Tour of Paris & River Cruise with Hotel Pick-Up,"Paris, France"
Somme and Ypres Battlefields WWI 2-Day Trip from Paris,"Paris, France"
Private Mont Saint-Michel Trip by Mercedes from Paris with Lunch,"Paris, France"
Guided and Private Tour of 3 hours through Paris aboard a Citroën 2cv,"Paris, France"
Luxury Evening Dining Experience at Chateau de Vaux-le-Vicomte,"Paris, France"
Private Giverny & Versailles all Day Tour from Paris Including Lunch,"Paris, France"
Bruges Highlights Trip from Paris Lunch Boat Brewery & Chocolate,"Paris, France"
Paris Private Transfer to Disneyland,"Paris, France"
Sacred Heart and Montmartre with private guide,"Paris, France"
Montmartre French Bistrot Style Food & Wine Tasting Tour,"Paris, France"
Parisian Monuments & Hidden Gems: A Thrilling Motorbike Tour,"Paris, France"
"Palace of Versailles: tickets, audio guide and transfer","Paris, France"
Paris Street Art Walking Tour,"Paris, France"
Champagne Private Wine Day Trip with Lunch and Wine Tastings,"Paris, France"
ORLY - Euro Disney - ORLY (Two Way) Private Shuttle Transfer,"Paris, France"
Montmartre Walking Tour with a Private Local Guide,"Paris, France"
"Loire Castles : Cheverny, Chenonceau, Chambord Guided Tour from Paris","Paris, France"
Hard Rock Cafe Paris with Set Menu for Lunch or Dinner,"Paris, France"
Bus Toqué Champs-Elysées PARIS BY NIGHT Ô CHATEAU,"Paris, France"
2 Days in Paris with a Friendly Local Guide,"Paris, France"
"Scandalous Paris, audioguided smartphone tour","Paris, France"
LOURDES : COME FOR A DAY - Private Day-trip from PARIS by High Speed Train,"Paris, France"
Montmartre-Sacré Coeur Walking Tour: Semi Private Experience,"Paris, France"
Arrival Transfer from Paris Airport CDG to Paris in Private Car,"Paris, France"
Visit of the Palace of Versailles,"Paris, France"
Paris by Night: A Walking Tour through the City of Lights,"Paris, France"
Paris Sidecar Tour: Montmartre the Village of Sin,"Paris, France"
Mont Saint Michel Private VIP Tour with Champagne from Paris,"Paris, France"
Investigation game - Montmarte,"Paris, France"
"Versailles Private Tour : Horse-riding, Gastronomy & the Palace","Paris, France"
Louvre Museum Paris Private Tour with Tickets and Transfers,"Paris, France"
Etretat and Le Havre Private Day Trip from Paris,"Paris, France"
Loire Valley Chateaux from Paris Private Tour,"Paris, France"
Discover the Champagne through its Terroirs in Paris !,"Paris, France"
Eiffel Tower Walking Photo Tour with Pro photographer - for solo travellers,"Paris, France"
Visit of Montmartre with a treasure hunt,"Paris, France"
Excursion CHATEAU DE VERSAILLES and GIVERNY in Limousine from Paris,"Paris, France"
Photographer in Paris - Lukas Nguyen Anh,"Paris, France"
Private Transfer to Disneyland Park,"Paris, France"
Private Louvre Museum Tour by Alberto Local Guide and his team in Paris,"Paris, France"
Louvre Museum Must-Sees: Skip-the-Line Semi-Private Guided Tour,"Paris, France"
Chantilly Private Excursion,"Paris, France"
A Day of Exploring Black Paris,"Paris, France"
