Attraction,City
Full Day Private Tour in Paris with Wine Tasting,"Paris, France"
Louvre With Hotel Pick up And Seine Cruise Tickets,"Paris, France"
Private Self-Guided Audio Tour in Paris Montmartre District,"Paris, France"
Full Day Paris Tour and Wine Tasting with Louvre and Versailles,"Paris, France"
The Army Museum of Paris Access Tickets,"Paris, France"
Private Chantilly & Horse Museum with Minivan,"Paris, France"
Paris Deluxe Shore Excursion from Le Havre,"Paris, France"
4 Hour Private Photoshoot Tour & Lunch at Eiffel Summit,"Paris, France"
Private Highlights Tour of Paris by Car (Half Day),"Paris, France"
Private Transfer One Way from Paris Hotel to Disneyland Paris,"Paris, France"
Giverny and Rouen Private Full Day Tour from Paris Van and Guide,"Paris, France"
Private Dinner at Eiffel Hotel Pick Up Photoshoot Seine Cruise,"Paris, France"
Disneyland Paris Private Trip,"Paris, France"
"Private round transfer to Rouen, Honfleur, Deauville from Paris","Paris, France"
Viator Exclusive: French Dinner & Cabaret Show in Artist's Home,"Paris, France"
Vintage Shopping with a guide in Paris,"Paris, France"
Exclusive Paris Gallery Tour,"Paris, France"
2 Hour Walking Tour Paris Love Stories,"Paris, France"
Private Photo Shoot Tour with Professional Photographer,"Paris, France"
Skip-the-Line Musee d'Orsay Private Tour with an Expert Guide,"Paris, France"
Private Transfer: Paris City to Paris Disneyland in Business Car,"Paris, France"
Beaux-Art Gallery Walk - Private Tour,"Paris, France"
Inspiring Paris Walking Tour for Couples,"Paris, France"
Paris Vintage Car Tour with Louvre & Versailles and CDG Transfers,"Paris, France"
Eiffel Summit & Crepe with 1-Hour Private Professional Photoshoot,"Paris, France"
Paris Private SightSeeing Tour - 6 Hours,"Paris, France"
"Explore the Impressionist Countryside of Renoir, Monet etc. and Learn French","Paris, France"
"Paris tour, Dinner cruise & Galeries Lafayette with CDG Transfers","Paris, France"
"8 hours Paris tour with Montmartre, Marais, Galeries Lafayette and Lunch cruise","Paris, France"
Private Round-Trip Transfer Paris Orly Airport (ORY),"Paris, France"
Skip-the-line Château de Chantilly Trip by Car from Paris,"Paris, France"
Parisian Delights: Private Tour from Le Havre,"Paris, France"
7-day Small Group ALL Normandy D-Day Castles & Burgundy Wine Trip,"Paris, France"
"2-day M.St-Michel, D-Day, 3 Loire Castles Small-group from Paris","Paris, France"
Private Tour 3 Days WWII Dunkirk 1940 and Dieppe 1942 From Paris,"Paris, France"
Giverny Versailles Trianon Small Group from Paris by Minivan,"Paris, France"
Private D-Day Omaha Utah Beach Guided Trip from Paris by Mercedes,"Paris, France"
DayTrip to Monet's Gardens with Lunch and Oil Painting Experience,"Paris, France"
2-day Private D Day Omaha Utah Beaches Live Guided from Paris,"Paris, France"
A Full-Day Paris Tour from Le Havre for Cruise Passengers,"Paris, France"
Private Tour 5 Days in Normandy from Paris with Lunch and Hotel,"Paris, France"
Half Day Trip from Paris to Giverny with Skip the Line Access,"Paris, France"
Private DDAY tour with pickup in Paris Full day,"Paris, France"
Montmartre's Secrets and Tastes in a Private Walking tour,"Paris, France"
"Full Day Eiffel, Seine Cruise and Paris Tour with CDG Transfer","Paris, France"
Paris - Historic Guided Walking tour,"Paris, France"
Half-Day Eiffel Tower and Seine River Cruise Private Tour,"Paris, France"
"Private Champagne de Castellane, Mercier Tastings Cellars Visits","Paris, France"
Private French Fashion History Walking Tour,"Paris, France"
Little Rendezvous in France | 6D5N Private tour in Paris and Nice,"Paris, France"
Private Walking Tour in Montmartre,"Paris, France"
Eiffel Tower Summit 3rd Floor Tour with Guide and Pick-up Drop,"Paris, France"
"Le Marais Food Tour - Bakeries, Chocolate and Patisseries","Paris, France"
"Food, Culture & History Tour of the Jewish Quarter in Paris","Paris, France"
Driver service: Paris to Deauville and Honfleur round trip - 12 hours,"Paris, France"
Paris Private Vintage Car Half Day Tour Eiffel Summit and Crepe,"Paris, France"
Private Direct Transfer From Paris to Reims,"Paris, France"
Paris Canaille,"Paris, France"
Full-Day Private Tour in Paris with CDG Airport Pick Up,"Paris, France"
Paris at Your Own Pace: Round Trip from Le Havre Cruise Port,"Paris, France"
Wine/Cheese Tasting - Wine & Cheese Tasting,"Paris, France"
Half Day Trip: Paris to Giverny Monet's Gardens & House,"Paris, France"
5 Hours Paris Eiffel Tower First and Second Floor Direct Ticket,"Paris, France"
Private Departure Transfer from Paris City centre to Paris Orly airport,"Paris, France"
Private Exquisite Red & White Burgundy Wines Trip from Paris,"Paris, France"
Private Transfer from the City of Paris to Reims or Épernay,"Paris, France"
Private Giverny and Montmartre Tour with Pickup,"Paris, France"
2 hours Guided Tour of the Eiffel Tower with Summit Access,"Paris, France"
Half-Day Private Eiffel Tour with Hotel Pickup and Eiffel Tower,"Paris, France"
Celebrate in Paris with Photo Portraits of You by a Professional Photographer,"Paris, France"
Paris to Frankfurt one way Private Transfer,"Paris, France"
Private Tour with Guide to Midnight in Paris Movie Locations,"Paris, France"
"Private Fontainebleau, Versailles, Trianon from Paris by Mercedes","Paris, France"
Skip the Line Eiffel Tower Ticket and Audio Guide Tour Commentary,"Paris, France"
Private Transfer Paris round trip Charles de Gaulle Airport,"Paris, France"
Arc de Triomphe Walking Tour: Paris Views and a Taste of Macarons,"Paris, France"
"Street art in Montmartre, between history and modernity","Paris, France"
2 Hour Louvre Museum Private Walking Tour with Licensed Guide,"Paris, France"
Private Day Tour: Chablis Vine from Paris,"Paris, France"
One way Private Transfer from Paris City to Gare Saint Lazare,"Paris, France"
Private Paris city tour & cruise with Minivan,"Paris, France"
Private Tour from Paris with Lunch in Cruise,"Paris, France"
Private Full-Day Tour in Paris with Louvre and Saint Germain des Pres,"Paris, France"
Napoleon Film and Life Locations in Paris Private Guided Tour,"Paris, France"
"Saint Germain des pres, Eiffel Summit & River Cruise Private Tour","Paris, France"
Transfer and Full Day Private Tour in Paris with Lunch Cruise,"Paris, France"
"3-hour Paris short walk ,Seine Cruise with CDG Airport Pick up","Paris, France"
Paris Full-Day Private Tour with Seine River Cruise and Lunch,"Paris, France"
Belleville Gallery Walk - Private Tour,"Paris, France"
6 Hours Paris City Tour With Photos Taken At All Stops,"Paris, France"
Full Day French Revolution Walking Tour in Paris,"Paris, France"
Visit Eiffel Summit with Crepe & Waffle Tasting,"Paris, France"
Private transfer from CDG or Orly airport to Paris or back,"Paris, France"
Backpacker's Private Tour of Paris - Experience best of everything with a local,"Paris, France"
Private Eiffel Tower Tour with Falafel and Wine Tasting,"Paris, France"
Private Eiffel Tower Tour with Falafel and Wine Tasting,"Paris, France"
Private one day round tour from Paris to London,"Paris, France"
Private transfer by luxury Mercedes from PARIS to ==> BAYEUX with Cab-Bel-Air,"Paris, France"
Seine Cruise with Shopping at Vallee Village and Saint Germain des pres-8 hours,"Paris, France"
"12-hours Paris City Tour with Cruise Lunch, Montparnasse and Crazy Horse Visit","Paris, France"
Private Tour of the Verdun 1916 battlefields from PARIS,"Paris, France"
"Half-Day Private Eiffel Summit , Crepe & Seine River Lunch Cruise","Paris, France"
Private Transfer from Paris to Caen - Up to 7 people,"Paris, France"
Paris French Wines Private Tasting and Class,"Paris, France"
Full Day Paris VIP Open deck bus shopping Tour Private Pick up,"Paris, France"
"10 hours Paris city with Galeries Lafayette,Montparnasse,Marais and Moulin Rouge","Paris, France"
Paris Airport CDG Round-Trip Transfer in Private Car,"Paris, France"
Round trip transfer in private vehicle Paris Orly Airport (ORY)- Paris City,"Paris, France"
Private one way transfer from Paris to Beauvais airport,"Paris, France"
Family Tour of Paris Old Town and Grévin Museum,"Paris, France"
Private Transfer from Charles De Gaulle Airport to Disneyland,"Paris, France"
Private Night Tour of Paris by a Vintage Car and Wine Tasting,"Paris, France"
Eiffel Tower Morning Tour Access with English Guide,"Paris, France"
Montmartre Marvels: A Small Group Guided Stroll in Bohemian Paris,"Paris, France"
Paris 3-hour Private Tour including Seine River Cruise,"Paris, France"
Exclusive Photo Shoot in Paris,"Paris, France"
Da Vinci House - Amboise Castles - Private Trip,"Paris, France"
Perfume Workshop and Sparkling Wine with Eiffel Tower View,"Paris, France"
"Champagne Mercier, Le Gallais, Pressoria Small-group from Paris","Paris, France"
Eiffel Tower Tour and Open Bus Experience with Wine Tasting,"Paris, France"
Private Highlights Tour of Paris by Car (Full Day),"Paris, France"
Private Transfer: Paris City to Port of LE HAVRE by Business Car,"Paris, France"
The Ultimate Montmartre Semi-Private Walking Tour & Sacre Coeur,"Paris, France"
Private Airport Shuttle Transfer CDG or Orly to Paris,"Paris, France"
Rise Above Paris Eiffel Tower Climbing Tour with Summit Access,"Paris, France"
10-Hour Paris Private Tour with Seine Cruise and Lunch,"Paris, France"
Orsay by night private tour,"Paris, France"
Private tour Paris Sightseeing 2 hours in Renault 4L electric,"Paris, France"
Private Parisian Wine and Food Tastings,"Paris, France"
Private walking in Paris with a photographer,"Paris, France"
Private Transfer: Paris City to Paris Airport ORY in Business Car,"Paris, France"
Palace Of Chambord - Private Trip,"Paris, France"
Private Day Trip Tour to Versailles with a local,"Paris, France"
Private Transfer between Paris Airport CDG - Paris Airport ORY,"Paris, France"
Emily in Paris Filming Locations on Private Tour with Local Guide,"Paris, France"
Paris Wheelchair Accessible Custom Tour: Full-Day w/ Local Guide,"Paris, France"
4 Hour Private Musée D'Orsay and Musée Rodin Tour in Paris,"Paris, France"
Loire Valley Castles Private Tour by Minivan from Paris,"Paris, France"
Luxury transfer from PARIS => to LUXEMBOURG (Duchy) with Cab-Bel-Air,"Paris, France"
Louvre Museum Tickets and Seine River Cruise combo,"Paris, France"
Private driver transfers Roissy CDG Airport and Paris,"Paris, France"
Le Marais Private Tour with Falafel & Wine Tasting & Pick up,"Paris, France"
Full-Day Private Tour Eiffel Tower & Cruise with CDG Transfers,"Paris, France"
Arrival Transfer: Paris Airport CDG to Paris City in Luxury Car,"Paris, France"
Marais Walking Tour in the Medieval Heart of Paris,"Paris, France"
5-Hour Seine Cruise with Shopping at la Vallee Village with Pick up,"Paris, France"
Private French Beer Tasting Tour in Paris Old Town,"Paris, France"
5-Hours Saint Germain Des Pres and Seine River Cruise with Montmartre,"Paris, France"
Marie Antoinette Filming Locations on Private Paris Tour,"Paris, France"
Private Van Transfer to or from Beauvais Tillé Airport,"Paris, France"
"Eiffel, Seine cruise & Paris by night with hotel Pick up & drop.","Paris, France"
Paris to Nice Private Transfer,"Paris, France"
Visit of Bruges in 1 day from Paris,"Paris, France"
Private Tasting Day Tour from Paris to Beaune,"Paris, France"
French Caviar & Champagne Tasting Masterclass by Passport Gourmet,"Paris, France"
Medieval Landmarks of Paris Walking Tour,"Paris, France"
Paris 4 hours Tour in Small Group with an Expert Driver,"Paris, France"
Half Day Tour with Pick up from Paris Beauvais Airport,"Paris, France"
The Palace of Versailles & Gardens: Private Day Trip from Paris,"Paris, France"
Paris Private Half Day Tour including Louvre Museum (Luxury van),"Paris, France"
Musée d'Orsay: 2-Hour Private Tour with Reserved Access,"Paris, France"
Bus Transfer : Paris to the Palace of Versailles Round-Trip,"Paris, France"
Private Versailles Full Day with Minivan,"Paris, France"
Food-Wine Walking Tour & Eiffel Summit with Hotel Pick Up,"Paris, France"
Private Champagne Pommery and Ayala Cellars Tastings Guided Tours,"Paris, France"
Paris Seine River 1h Private Cruise,"Paris, France"
Chateaux Blois — Chaumont — Da Vinci Clos Lucé Small-group trip,"Paris, France"
Private Christmas Market Photoshoot at Jardin des Tuileries,"Paris, France"
Eiffel Tower and Arc de Triomphe Private Tour with Hotel Pick up,"Paris, France"
10 Hours Paris Tour with Seine River Dinner Cruise and Hotel pick up,"Paris, France"
BURGUNDY : Wine Tasting & Visits- Private Day Trip From Paris,"Paris, France"
Photoshoot Experience in Paris,"Paris, France"
Full-Day to Le Marais with la Vallée Village Shopping Tour,"Paris, France"
Full Day Paris Open Deck Bus Shopping Tour with Wine Tasting,"Paris, France"
Private M.St.-Michel D-Day Omaha Pointe du Hoc American Cemetery,"Paris, France"
Paris to Cannes Private Transfer,"Paris, France"
Exclusive Paris Louvre Private Guided Tour with Top-rated Expert,"Paris, France"
"Loire castles, Chambord and Blois excursion from Paris","Paris, France"
ORLY - CDG (One Way) Private Shuttle Transfer,"Paris, France"
Private Day Trip to Champagne Region with Lunch,"Paris, France"
"2-Hour Paris Notre-Dame Cathedral, Louvre, Sainte-Chapelle Tour","Paris, France"
e Sim 10 GB for 30 days,"Paris, France"
4 hours Paris private Montmartre Walking Tour and Seine River Cruise,"Paris, France"
Luxury Transfer Paris Beauvais Airport BVA to ==> Paris,"Paris, France"
"10 Hours Private Tour Eiffel Summit with Marais, Louvre and City","Paris, France"
True Parisian Shopping Experience a Private Activity,"Paris, France"
Food Tour Near Eiffel with Wine Cheese Tasting & Hotel Pick up,"Paris, France"
Eiffel Tower and Crepe Tasting Tour with Hotel Pick Up,"Paris, France"
Paris Private City Tour with Hotel Apartment Pickup & Drop off Included,"Paris, France"
Full day private Round Tour to Paris from Le Havre Port,"Paris, France"
"Full-Day Tour to Eiffel Tower, Saint Germain and Seine River Lunch Cruise","Paris, France"
Paris Service Privilege Lunch Cruise - Bateaux Parisien,"Paris, France"
"Paris ,Saint Germain Half-Day Tour & Cruise with CDG Transfers","Paris, France"
Paris Iconic Sightseeing Spots - Self-Guided Walking Tours,"Paris, France"
Day Trip Champagne Meeting to Champagne Growers from Reims,"Paris, France"
Departure Private Transfer from Paris city to Paris ORY Airport by Business Car,"Paris, France"
Guided tour of Buttes Chaumont and its surroundings,"Paris, France"
8-day Small group Guided Tour Paris — M.St.Michel —8 Attractions,"Paris, France"
Private Half Day Guided Tour in Montmartre and Musée d’Orsay,"Paris, France"
Private Transfer between Paris - La Vallee Village by Luxury Van,"Paris, France"
Walking Tour of Paris Old Town and Seine River Cruise,"Paris, France"
Paris Private Night Tour with CDG Airport Pickup,"Paris, France"
Private Chartres with Minivan,"Paris, France"
Private Paris Essentials Tour,"Paris, France"
La Vallée Village shopping tour with personal photographer 5 hrs,"Paris, France"
Full-Day Paris City Tour with Seine Lunch Cruise and Paradis Latin,"Paris, France"
Private Transfer from Paris to Beauvais-Tillé Airport (BVA),"Paris, France"
Private transfers between Orly airport and Paris,"Paris, France"
Full-Day Private Tour Eiffel tower and Seine River Cruise,"Paris, France"
Giverny and Wine Tasting with Private Pick up and Drop Off,"Paris, France"
"Giverny, Cruise & Eiffel photoshoot with Private Pick up/drop off","Paris, France"
Best districts of Paris in 1 Day - Private Tour,"Paris, France"
Mont Saint Michel Private VIP Tour from CDG Airport Pick up,"Paris, France"
Louvre Museum Access And Seine River Cruise Tour,"Paris, France"
Small Group Paris City Tour and River Cruise with Champagne,"Paris, France"
"Full Day Tour Giverny, Versailles & Eiffel with Private Pick up","Paris, France"
Paris Private Vintage Car Half day Tour with Eiffel Tower 2nd Floor by Elevator,"Paris, France"
Transfer in private vehicle from Paris City - Paris Orly Airport (ORY),"Paris, France"
Private 4hour Paris Tour & Lunch Cruise with CDG Airport Pick Up,"Paris, France"
Private Arrival Transfer from Brussels Airport or city to Paris By Luxury Car,"Paris, France"
"Normandy gastronomic tour from Paris : cidery, dairy, and typical villages !","Paris, France"
Private Experience: The Traditional Pie,"Paris, France"
Private City Tour of Paris (Emily in Paris highlights),"Paris, France"
Paris to D-Day Beaches Full Day Private Tour with Guide,"Paris, France"
Quad ride to discover Paris,"Paris, France"
Breathing bubble,"Paris, France"
Eiffel Tower 1-Hour Private Professional Photoshoot,"Paris, France"
7 Hours Private Seine River Cruise I Moulin Rouge I Wine Tasting,"Paris, France"
Louvre Museum,"Paris, France"
Paris to Bruges Private Full-Day Tour,"Paris, France"
Curated Natural Wine Tasting and Cinematic Eiffel Photoshoot,"Paris, France"
Full-Day Tour to Eiffel Tower with Seine River Dinner Cruise and Saint Germain,"Paris, France"
5 Hour Paris Tour with Hotel Pick Up and Drop with Wine Tasting,"Paris, France"
Private Guided Tour of Louvre Museum with CDG Airport Pick up,"Paris, France"
Paris to Reims Private Transfer,"Paris, France"
Paris Highlights exploration Notre Dame & Ile de la cité quarter,"Paris, France"
Paris by Day and Paris by Night Private Tour,"Paris, France"
Paris Photoshoot by Professional Photographer with BVA Transfers,"Paris, France"
Private Tour in Medieval Paris with Latin Quarter and Panthéon,"Paris, France"
Eiffel Summit and Crepe Tasting with Pickup Included,"Paris, France"
"Paris Open Bus Tour with Cruise, Eiffel Summit, Crepe and Pick up","Paris, France"
"Paris Mosaic for Cruisers - Shopping, Sightseeing, Dining","Paris, France"
"8 hours Paris city tour with Montmartre, Le Marais and Saint Germain Des Pres","Paris, France"
Mont Saint Michel D Day Omaha Beach Private VIP Tour with Champagne from Paris,"Paris, France"
Europe Interrail - Student Self-Guided Audio Walking Tours,"Paris, France"
Giverny and Eiffel Tower Photoshoot with CDG Pick Up and Drop,"Paris, France"
Private Transport from Hotel To Gare de l'est Railway Station,"Paris, France"
Private Shuttle from Orly Airport to Paris: Premium Service,"Paris, France"
CDG pickup and 6 hours Private Tour of Marais & Montmartre,"Paris, France"
Indian Lunch Experience with Wine Tasting in Paris,"Paris, France"
Louvre Museum Ticket with Priority Entrance & Audio Guide,"Paris, France"
Private Day Trip Tour to Bruges from Paris with a local,"Paris, France"
Private Paris Trip & Cruise Dinner with CDG Airport Pick up,"Paris, France"
Private transfer by luxury Mercedes from PARIS to ==> REIMS with Cab-Bel-Air,"Paris, France"
"8 hours Paris Tour with Louvre Museum, Saint-Germain-des-Pres and Dinner cruise","Paris, France"
"Old Jewish Quarter and Museum Private Tour in Marais, Paris","Paris, France"
Original Paris Pub Crawl,"Paris, France"
Private Self-Guided Walking Tour in Paris with your Smartphone,"Paris, France"
"Paris Picasso National Museum Private tour-1h30, Skip the line","Paris, France"
Proposal in Paris Centre with Photoshoot & Video,"Paris, France"
Private Transfer: Port of LE HAVRE to Paris Airport CDG in Business Car,"Paris, France"
Eiffel Summit & Montmartre Cheese with Wine Tasting Private Tour,"Paris, France"
Paris’ Iron Lady: A Self-Guided Audio Tour,"Paris, France"
"GRAND VINTAGE Private Champagne Taittinger, Veuve Clicquot Trip","Paris, France"
4 hours Paris VIP Private Tour with exclusive guide & driver both,"Paris, France"
Rolls Royce Paris Full Day Private Tour with Seine River Cruise,"Paris, France"
Paris Menu Dinner Night Cruise-Bateaux Parisien,"Paris, France"
Private Transfer from Paris to Amsterdam,"Paris, France"
5 hours Paris Trip with Photoshoot and Eiffel Tower including hotel pickup,"Paris, France"
"12-hour Tour Lunch cruise, Montparnasse and Paradis Latin Paris","Paris, France"
Private Activity for Cooking Foie Gras Terrine,"Paris, France"
Private 10-hour round transfer to Champagne Epernay from Paris. Best offer!,"Paris, France"
Paris Highlights with an LGBTQ Perspective Private Tour,"Paris, France"
Paris to Montreux one way Private Transfer,"Paris, France"
Private Full Day Paris trip 8 hours including Eiffel and Versailles with Pickup,"Paris, France"
Paris Private Small Group Tour with Beauvais Transfers,"Paris, France"
"Montmartre , Metro and Indian Meal in Paris","Paris, France"
Paris Tour with Wine Tasting and Lunch Cruise and Paradis Latin,"Paris, France"
Eiffel Tower Summit (ALL FLOORS) By LIFT With Private Pick-Up,"Paris, France"
"2-day Loire Valley 6 Castles Small-group from Paris, Wine tasting","Paris, France"
Gourmet Footsteps in Montmartre: Historic Tour with 3 Course Meal,"Paris, France"
Transfer Airport Paris-Hotel in Portuguese,"Paris, France"
Mont Saint Michel Private Tour with Eiffel Tower Photoshoot,"Paris, France"
Private Van Transfer from CDG Airport To Versailles,"Paris, France"
Round-trip private transport Paris Charles de Gaulle airport,"Paris, France"
Paris City Day Tour with Chauffeur Service PO-2,"Paris, France"
Paris Red Light District Walking Tour,"Paris, France"
Private Transfer from Paris City to Beauvais Airport (BVA),"Paris, France"
Private Transfer from Paris to Austerlitz Railway Station,"Paris, France"
Private Souvenir Photo Session at the Eiffel Tower,"Paris, France"
"Pantheon, Hop-on Hop-off Big Bus Tour","Paris, France"
Loire Valley Castles Private Tour From Paris/skip-the-line ticket,"Paris, France"
"Arc de Triomphe : Private guided tour with ""ticket included""","Paris, France"
Paris to Brussels Private Transfer,"Paris, France"
"French Food, Restaurants in Paris Self-Guided Tour Booklet","Paris, France"
Skip-the-line Palace of Versailles Private Trip from Paris,"Paris, France"
"Paris Private trip with Eiffel Tower, Seine Cruise and professional photoshoot","Paris, France"
Private Reims Champagne with Minivan,"Paris, France"
"8 hours Paris Tour with Montmartre, Le Marais, Cruise & Saint Germain des pres","Paris, France"
Arrival Private Transfer: CDG or ORY Airport to Disneyland París by Luxury Van,"Paris, France"
Paris Private Transfer in Luxurious Bentley,"Paris, France"
5 Hour Private Tour to Eiffel Summit with Crepe & Waffle Tasting,"Paris, France"
From Paris Landing Beaches with Guide & Hotel Pick Up,"Paris, France"
7-Day Private Tour of Paris and Barcelona,"Paris, France"
Private One Way Paris Airport (CDG-ORLY) Transfer Minivan From or To Paris,"Paris, France"
Paris French Revolution Marie Antoinette Les Misérables Tour,"Paris, France"
Magnificence on Every Corner - Paris Walking Tour,"Paris, France"
Paris: Private Pastry Food Tour of French Sweet and Desserts,"Paris, France"
Charles de Gaulle Airport (CGY) to Paris Arrival Private Transfer,"Paris, France"
Private trip Burgundy from Paris 20 Chablis Wines tasting,"Paris, France"
Photography Tour and Workshop in Paris,"Paris, France"
Paris Half Day Private Tour with Eiffel Tower and Wine Tasting,"Paris, France"
Private Transfer from CDG and Orly Airports in Paris to Le Havre,"Paris, France"
"A cultural break in Burgundy, 1 hour from Paris","Paris, France"
Private Full Day Trip to Loire Valley Castles with Wine Tasting,"Paris, France"
Wine and Cheese Tasting in Saint Germain,"Paris, France"
Paris for Kids & Toddlers Private Tour with a local,"Paris, France"
Full-Day Private Tour in Paris with Hotel Pick Up,"Paris, France"
Bruges From Paris All Day Guided Private Tour,"Paris, France"
The Legends of Père Lachaise through 20 Artists,"Paris, France"
6 hours Paris Evening Tour with Montparnasse and Paradis Latin,"Paris, France"
Rodin's Museum Masterpiece and Inside Musée d'Orsay,"Paris, France"
Paris Underground: Visit Notre Dame’s Crypt And The Catacombs,"Paris, France"
Private Guided Tour of Paris by bike-cab : The 'Emily Cooper',"Paris, France"
Paris Private Vintage Car Trip with Eiffel Tower and hotel Pick up,"Paris, France"
Montmartre Quarter Private Guided Tour in Paris,"Paris, France"
Montmartre semi private walking tour,"Paris, France"
Paris Exclusive Tour on a Classic Citroën DS with Open Roof,"Paris, France"
Skip-the-line Panthéon Paris Tour with Dome and Transfers,"Paris, France"
Proposal in Paris at the Eiffel Tower with Photoshoot & Video,"Paris, France"
CHANTILLY & COMPIEGNE PALACE (lunch in SENLIS ) -from your hotel in PARIS -,"Paris, France"
Napoleon's Guided Tour for Kids & Families in Paris,"Paris, France"
3 Hour Tasting Class in Paris,"Paris, France"
One way Private Transfer from Gare du Nord station to Paris City or Hotel,"Paris, France"
Private Sculptures and Stories Tour in Rodin Museum,"Paris, France"
Montmartre and Seine River Dinner Cruise with Hotel pick up in Paris- 6 Hrs,"Paris, France"
Private History Walking Tour in Paris for Teens & Family,"Paris, France"
Private Transfer from Paris city to Le Havre Cruise Port,"Paris, France"
Private Luxury Transfer from Paris to Bourget Airport,"Paris, France"
The story of Victor Hugo in Paris Old Town Tour & Museum,"Paris, France"
Paris private Open deck bus with cruise and louvre with Pick up,"Paris, France"
Private One-way Paris Orly Airport Transfer To/From Paris,"Paris, France"
Paris Gare de l'est Railway Station to your hotel in Paris Private Transfer,"Paris, France"
Private driver departing from Orly airport to Paris: Premium service,"Paris, France"
Private Transfer from Paris to Charles de Gaulle Airport,"Paris, France"
Two Hours Quick Private Tour of Paris with Hotel pickup,"Paris, France"
Paris Custom Private Tour from Notre Dame to the Eiffel Tower,"Paris, France"
Half-Day Eiffel and River Cruise Private Tour,"Paris, France"
Château de Chambord & Chenonceau from Paris by Car,"Paris, France"
Transfer by luxury Mercedes from PARIS AIRPORT to => PARIS with Cab-Bel-Air,"Paris, France"
Revolutionary Paris Walking Tour: Iconic Sights & Stories,"Paris, France"
5 hours Tour at Marais and Montmartre in Paris with Wine Tasting,"Paris, France"
5-Hour Le Marais and Cruise with Lunch with CDG Airport Pick up,"Paris, France"
